title,university,form,link,category
Business Foundations,University of Pennsylvania,specialization,https://www.coursera.org/specializations/wharton-business-foundations,business/business-strategy
AI For Everyone,deeplearning.ai,course,https://www.coursera.org/learn/ai-for-everyone,business/business-strategy
Finance & Quantitative Modeling for Analysts,University of Pennsylvania,specialization,https://www.coursera.org/specializations/finance-quantitative-modeling-analysts,business/business-strategy
Design Thinking for Innovation,University of Virginia,course,https://www.coursera.org/learn/uva-darden-design-thinking-innovation,business/business-strategy
Entrepreneurship,University of Pennsylvania,specialization,https://www.coursera.org/specializations/wharton-entrepreneurship,business/business-strategy
Human Resource Management: HR for People Managers,University of Minnesota,specialization,https://www.coursera.org/specializations/human-resource-management,business/business-strategy
Digital Transformation,BCG,course,https://www.coursera.org/learn/bcg-uva-darden-digital-transformation,business/business-strategy
Customer Analytics,University of Pennsylvania,course,https://www.coursera.org/learn/wharton-customer-analytics,business/business-strategy
Supply Chain Management,Rutgers the State University of New Jersey,specialization,https://www.coursera.org/specializations/supply-chain-management,business/business-strategy
Supply Chain Logistics,Rutgers the State University of New Jersey,course,https://www.coursera.org/learn/supply-chain-logistics,business/business-strategy
Marketing Gerencial,Universidad de Chile,course,https://www.coursera.org/learn/marketing-gerencial,business/business-strategy
Business Metrics for Data-Driven Companies,Duke University,course,https://www.coursera.org/learn/analytics-business-metrics,business/business-strategy
Organizational Leadership,Northwestern University,specialization,https://www.coursera.org/specializations/organizational-leadership,business/business-strategy
Model Thinking,University of Michigan,course,https://www.coursera.org/learn/model-thinking,business/business-strategy
Introduction to Operations Management,University of Pennsylvania,course,https://www.coursera.org/learn/wharton-operations,business/business-strategy
Costos para los Negocios,Universidad de Chile,course,https://www.coursera.org/learn/costosparanegocios,business/business-strategy
Business Strategy,University of Virginia,specialization,https://www.coursera.org/specializations/business-strategy,business/business-strategy
Construction Project Management,Columbia University,course,https://www.coursera.org/learn/construction-project-management,business/business-strategy
"Advanced Valuation and Strategy - M&A, Private Equity, and Venture Capital",Erasmus University Rotterdam,course,https://www.coursera.org/learn/advanced-valuation-and-strategy,business/business-strategy
New Models of Business in Society,University of Virginia,course,https://www.coursera.org/learn/uva-darden-business-society,business/business-strategy
Business Technology Management,Indian School of Business,specialization,https://www.coursera.org/specializations/business-technology-managment,business/business-strategy
Sustainable Fashion,Copenhagen Business School,course,https://www.coursera.org/learn/sustainable-fashion,business/business-strategy
Behavioral Finance,Duke University,course,https://www.coursera.org/learn/duke-behavioral-finance,business/business-strategy
Innovation Management,Erasmus University Rotterdam,course,https://www.coursera.org/learn/innovation-management,business/business-strategy
Innovation: From Creativity to Entrepreneurship,University of Illinois at Urbana-Champaign,specialization,https://www.coursera.org/specializations/innovation-creativity-entrepreneurship,business/business-strategy
Marketing e vendas B2B: Fechando novos negócios,Universidade de São Paulo,course,https://www.coursera.org/learn/marketing-vendas-b2b,business/business-strategy
Branding: The Creative Journey,IE Business School,specialization,https://www.coursera.org/specializations/branding-the-creative-journey,business/business-strategy
Foundations of Business Strategy,University of Virginia,course,https://www.coursera.org/learn/uva-darden-foundations-business-strategy,business/business-strategy
Gestión de organizaciones efectivas,Pontificia Universidad Católica de Chile,course,https://www.coursera.org/learn/gestion-organizaciones-efectivas,business/business-strategy
"High Performance Collaboration: Leadership, Teamwork, and Negotiation",Northwestern University,course,https://www.coursera.org/learn/leadership-collaboration,business/business-strategy
Operations Analytics,University of Pennsylvania,course,https://www.coursera.org/learn/wharton-operations-analytics,business/business-strategy
Strategic Management and Innovation,Copenhagen Business School,specialization,https://www.coursera.org/specializations/strategic-management,business/business-strategy
Introdução ao Marketing Analítico,Insper,course,https://www.coursera.org/learn/marketing-analitico,business/business-strategy
Sports Marketing,Northwestern University,course,https://www.coursera.org/learn/sports-marketing,business/business-strategy
Blockchain Revolution,INSEAD,specialization,https://www.coursera.org/specializations/blockchain-revolution-enterprise,business/business-strategy
Strategic Management,Copenhagen Business School,course,https://www.coursera.org/learn/strategic-management,business/business-strategy
Negociación 4.0,Universidad Austral,course,https://www.coursera.org/learn/negociacion-iae,business/business-strategy
Design-Led Strategy: Design thinking for business strategy and entrepreneurship,The University of Sydney,course,https://www.coursera.org/learn/design-strategy,business/business-strategy
Cybersecurity and Its Ten Domains,University System of Georgia,course,https://www.coursera.org/learn/cyber-security-domain,business/business-strategy
Digital Advertising Strategy,University of Colorado Boulder,specialization,https://www.coursera.org/specializations/digital-advertising-strategy,business/business-strategy
Supply Chain Operations,Rutgers the State University of New Jersey,course,https://www.coursera.org/learn/operations,business/business-strategy
Inove na gestão de equipes e negócios: O crescimento da empresa,Universidade de São Paulo,course,https://www.coursera.org/learn/gestao-equipes-negocios,business/business-strategy
Leading: Human Resource Management and Leadership,Macquarie University,specialization,https://www.coursera.org/specializations/hr-management-leadership,business/business-strategy
Market Research,"University of California, Davis",specialization,https://www.coursera.org/specializations/market-research,business/business-strategy
Global Challenges in Business,University of Illinois at Urbana-Champaign,specialization,https://www.coursera.org/specializations/global-challenges-business,business/business-strategy
Intellectual Property Law,University of Pennsylvania,specialization,https://www.coursera.org/specializations/introduction-intellectual-property,business/business-strategy
How to Get Skilled: Introduction to Individual Skills Management (Project-Centered Course),The State University of New York,course,https://www.coursera.org/learn/skills-management,business/business-strategy
Circular Economy - Sustainable Materials Management,Lund University,course,https://www.coursera.org/learn/circular-economy,business/business-strategy
Gestão de Operações,Insper,course,https://www.coursera.org/learn/gestao-de-operacoes,business/business-strategy
Brand Identity and Strategy,IE Business School,course,https://www.coursera.org/learn/brand-identity-strategy,business/business-strategy
Competitive Strategy and Organization Design,Ludwig-Maximilians-Universität München (LMU),specialization,https://www.coursera.org/specializations/competitive-strategy,business/business-strategy
Business Transformation with Google Cloud,Google Cloud,course,https://www.coursera.org/learn/business-transformation-google-cloud,business/business-strategy
Conceitos Básicos de Logística e Supply Chain,Universidade Estadual de Campinas,course,https://www.coursera.org/learn/conceitos-basicos-logistica,business/business-strategy
Leadership Communication for Maximum Impact: Storytelling,Northwestern University,course,https://www.coursera.org/learn/leadership-storytelling,business/business-strategy
Internet Giants: The Law and Economics of Media Platforms,The University of Chicago,course,https://www.coursera.org/learn/internetgiants,business/business-strategy
Construction Cost Estimating and Cost Control,Columbia University,course,https://www.coursera.org/learn/construction-cost-estimating,business/business-strategy
Welcome to Game Theory,The University of Tokyo,course,https://www.coursera.org/learn/game-theory-introduction,business/business-strategy
Análisis de Datos para la toma de decisiones,Tecnológico de Monterrey,specialization,https://www.coursera.org/specializations/analisis-datos,business/business-strategy
Pricing Strategy Optimization,University of Virginia,specialization,https://www.coursera.org/specializations/uva-darden-bcg-pricing-strategy,business/business-strategy
Цифровой маркетинг и социальные сети,Peter the Great St. Petersburg Polytechnic University,course,https://www.coursera.org/learn/cifrovoj-marketing,business/business-strategy
Cybersecurity: Developing a Program for Your Business,University System of Georgia,specialization,https://www.coursera.org/specializations/cybersecurity-developing-program-for-business,business/business-strategy
Corporate Sustainability. Understanding and Seizing the Strategic Opportunity,Università Bocconi,course,https://www.coursera.org/learn/corp-sustainability,business/business-strategy
Strategic Business Analytics,ESSEC Business School,specialization,https://www.coursera.org/specializations/strategic-analytics,business/business-strategy
Digital Transformation in Financial Services,Copenhagen Business School,specialization,https://www.coursera.org/specializations/digital-transformation-financial-services,business/business-strategy
International Business I,University of New Mexico,course,https://www.coursera.org/learn/international-business,business/business-strategy
Supply Chain Planning,Rutgers the State University of New Jersey,course,https://www.coursera.org/learn/planning,business/business-strategy
Influencer Marketing Strategy,Rutgers the State University of New Jersey,course,https://www.coursera.org/learn/influencer-marketing-strategy,business/business-strategy
Competitive Strategy,Ludwig-Maximilians-Universität München (LMU),course,https://www.coursera.org/learn/competitive-strategy,business/business-strategy
Business Model Canvas: A Tool for Entrepreneurs and Innovators (Project-Centered Course),University System of Georgia,course,https://www.coursera.org/learn/business-model-canvas,business/business-strategy
Global Trends for Business and Society,University of Pennsylvania,course,https://www.coursera.org/learn/wharton-global-trends-business,business/business-strategy
Business Model Innovation,HEC Paris,course,https://www.coursera.org/learn/business-model,business/business-strategy
FinTech: Finance Industry Transformation and Regulation,The Hong Kong University of Science and Technology,specialization,https://www.coursera.org/specializations/fintech,business/business-strategy
Operations Management: Analysis and Improvement Methods,University of Illinois at Urbana-Champaign,course,https://www.coursera.org/learn/operations-management,business/business-strategy
Supply Chain Management: A Learning Perspective,Korea Advanced Institute of Science and Technology(KAIST),course,https://www.coursera.org/learn/supply-chain-management,business/business-strategy
Formulación y evaluación de proyectos complejos,Universidad de los Andes,course,https://www.coursera.org/learn/formulacion-evaluacion-proyectos-ingenieria,business/business-strategy
Fundamentos Empresariales,University of Pennsylvania,specialization,https://www.coursera.org/specializations/wharton-fundamentos-empresariales,business/business-strategy
Business Strategy,University of Illinois at Urbana-Champaign,course,https://www.coursera.org/learn/strategy-business,business/business-strategy
The fundamentals of hotel distribution,ESSEC Business School,course,https://www.coursera.org/learn/hotel-distribution,business/business-strategy
Content Strategy for Professionals,Northwestern University,specialization,https://www.coursera.org/specializations/content-strategy,business/business-strategy
Strategising: Management for Global Competitive Advantage,Macquarie University,specialization,https://www.coursera.org/specializations/strategic-management-competitive-advantage,business/business-strategy
Strategic Business Management - Microeconomics,"University of California, Irvine",course,https://www.coursera.org/learn/strategic-business-management-microeconomics,business/business-strategy
Introduction to Intellectual Property,University of Pennsylvania,course,https://www.coursera.org/learn/introduction-intellectual-property,business/business-strategy
Construction Scheduling,Columbia University,course,https://www.coursera.org/learn/construction-scheduling,business/business-strategy
Research Proposal: Initiating Research,"University of California, Davis",course,https://www.coursera.org/learn/research-proposal-initiating-research,business/business-strategy
IT Project Management,Indian School of Business,course,https://www.coursera.org/learn/it-project-management,business/business-strategy
Supply Chain Sourcing,Rutgers the State University of New Jersey,course,https://www.coursera.org/learn/sourcing,business/business-strategy
Construction Finance,Columbia University,course,https://www.coursera.org/learn/construction-finance,business/business-strategy
Cost and Economics in Pricing Strategy,University of Virginia,course,https://www.coursera.org/learn/uva-darden-bcg-pricing-strategy-cost-economics,business/business-strategy
Fundamentos del análisis de datos para la toma de decisiones,Tecnológico de Monterrey,course,https://www.coursera.org/learn/analisis-de-datos,business/business-strategy
Digital Business Models,Lund University,course,https://www.coursera.org/learn/digital-business-models,business/business-strategy
Finance for Non-Financial Managers,Emory University,course,https://www.coursera.org/learn/finance-for-non-financial-managers,business/business-strategy
Bridging the Gap between Strategy Design and Delivery,Brightline Initiative,course,https://www.coursera.org/learn/bridging-strategy-design-delivery-gap,business/business-strategy
Negocios Internacionales I,University of New Mexico,course,https://www.coursera.org/learn/negocios-internacionales,business/business-strategy
Startup Entrepreneurship,Technion - Israel Institute of Technology,specialization,https://www.coursera.org/specializations/startup-entrepreneurship,business/business-strategy
Strategic Sales Management,Fundação Instituto de Administração,specialization,https://www.coursera.org/specializations/sales-management-bridging-gap-strategy-sales,business/business-strategy
Innovation for Entrepreneurs: From Idea to Marketplace,"University of Maryland, College Park",course,https://www.coursera.org/learn/innovative-entrepreneur,business/business-strategy
Estrategias de Redes Sociales,Universidad Austral,course,https://www.coursera.org/learn/redes-sociales-estrategias,business/business-strategy
Scaling Operations: Linking Strategy and Execution,Northwestern University,course,https://www.coursera.org/learn/operations-strategy,business/business-strategy
Operations Management: Strategy and Quality Management for the Digital Age,University of Illinois at Urbana-Champaign,course,https://www.coursera.org/learn/process-improvement,business/business-strategy
Organisational design: Know your organisation,Macquarie University,course,https://www.coursera.org/learn/organisational-design-know-your-organisation,business/business-strategy
Digital Transformations,Indian School of Business,course,https://www.coursera.org/learn/digital-transformations,business/business-strategy
Content Strategy for Professionals: Engaging Audiences,Northwestern University,course,https://www.coursera.org/learn/engagement-strategy,business/business-strategy
Understanding Modern Finance,Moscow Institute of Physics and Technology,specialization,https://www.coursera.org/specializations/understanding-modern-finance,business/business-strategy
Business Strategies for Social Impact,University of Pennsylvania,course,https://www.coursera.org/learn/wharton-social-impact,business/business-strategy
Strategic Business Management - Macroeconomics,"University of California, Irvine",course,https://www.coursera.org/learn/strategic-business-management-macroeconomics,business/business-strategy
Crowdfunding,University of Pennsylvania,course,https://www.coursera.org/learn/wharton-crowdfunding,business/business-strategy
Advanced Business Strategy,University of Virginia,course,https://www.coursera.org/learn/uva-darden-advanced-business-strategy,business/business-strategy
Advanced Search Engine Optimization Strategies,"University of California, Davis",course,https://www.coursera.org/learn/seo-strategies,business/business-strategy
Estrategia Empresarial,Universidad Austral,course,https://www.coursera.org/learn/estrategia-empresarial,business/business-strategy
Business Strategies for Emerging Markets,National Research University Higher School of Economics,course,https://www.coursera.org/learn/business-strategies,business/business-strategy
Organizational Design and Management,HEC Paris,course,https://www.coursera.org/learn/organizational-design-management,business/business-strategy
Digital Competition in Financial Services,Copenhagen Business School,course,https://www.coursera.org/learn/digital-competition-financial-services,business/business-strategy
Leadership Through Social Influence,Northwestern University,course,https://www.coursera.org/learn/leadership-socialinfluence,business/business-strategy
Developing Innovative Ideas for New Companies: The First Step in Entrepreneurship,"University of Maryland, College Park",course,https://www.coursera.org/learn/innovative-ideas,business/business-strategy
¿Cómo convertir mi idea en empresa?,Universidad de los Andes,course,https://www.coursera.org/learn/idea-empresa,business/business-strategy
Capitalismo Consciente,Insper,course,https://www.coursera.org/learn/capitalismo-consciente,business/business-strategy
The Cycle: Management of Successful Arts and Cultural Organizations,"University of Maryland, College Park",course,https://www.coursera.org/learn/the-cycle,business/business-strategy
Strategic Management of Innovation,HEC Paris,course,https://www.coursera.org/learn/strategic-management-of-innovation,business/business-strategy
Strategy and Sustainability,IESE Business School,course,https://www.coursera.org/learn/strategy-sustainability,business/business-strategy
Corporate Strategy,University of London,course,https://www.coursera.org/learn/corporatestrategy,business/business-strategy
"Application of AI, InsurTech, and Real Estate Technology",University of Pennsylvania,course,https://www.coursera.org/learn/wharton-ai-application-insurtech-real-estate-technology,business/business-strategy
"Grow to Greatness: Smart Growth for Private Businesses, Part I",University of Virginia,course,https://www.coursera.org/learn/uva-darden-smart-growth-strategy-1,business/business-strategy
Corporate Strategy,University of Illinois at Urbana-Champaign,course,https://www.coursera.org/learn/corporate-strategy,business/business-strategy
Fundraising and Development,"University of California, Davis",specialization,https://www.coursera.org/specializations/fundraising-development,business/business-strategy
IA para todos,deeplearning.ai,course,https://www.coursera.org/learn/ai-for-everyone-es,business/business-strategy
Strategic Planning and Execution,University of Virginia,course,https://www.coursera.org/learn/uva-darden-strategic-planning-execution,business/business-strategy
Strategy Formulation,Copenhagen Business School,course,https://www.coursera.org/learn/strategy-formulation,business/business-strategy
The Fundamentals of Revenue Management: The Cornerstone of Revenue Strategy,ESSEC Business School,course,https://www.coursera.org/learn/fundamentals-of-revenue-management,business/business-strategy
Corruption,University of Pennsylvania,course,https://www.coursera.org/learn/wharton-corruption,business/business-strategy
Data Visualization with Tableau Project,"University of California, Davis",course,https://www.coursera.org/learn/dataviz-project,business/business-strategy
Технология ведения международных переговоров,Moscow State Institute of International Relations (MGIMO) / МГИМО (Московский государственный институт международных отношений МИД России),course,https://www.coursera.org/learn/tekhnologiya-vedeniya-mezhdunarodnykh-peregovorov,business/business-strategy
Fundamentals of Global Energy Business,University of Colorado System,course,https://www.coursera.org/learn/energy-business,business/business-strategy
Qualitative Research,"University of California, Davis",course,https://www.coursera.org/learn/qualitative-research,business/business-strategy
Effective Sales – An Overview,Fundação Instituto de Administração,course,https://www.coursera.org/learn/effective-sales-overview,business/business-strategy
Quantitative Research,"University of California, Davis",course,https://www.coursera.org/learn/quantitative-research,business/business-strategy
Finance for Startups,Korea Advanced Institute of Science and Technology(KAIST),course,https://www.coursera.org/learn/finance-for-startups,business/business-strategy
Supply Chain Finance and Blockchain Technology,New York Institute of Finance,specialization,https://www.coursera.org/specializations/supply-chain-finance-and-blockchain-technology,business/business-strategy
Innovation and emerging technology: Be disruptive,Macquarie University,course,https://www.coursera.org/learn/innovation-technology-be-disruptive,business/business-strategy
Valuation and Financial Analysis For Startups,Yonsei University,specialization,https://www.coursera.org/specializations/startup-valuation,business/business-strategy
Introducción al Marketing,University of Pennsylvania,course,https://www.coursera.org/learn/wharton-introduccion-marketing,business/business-strategy
Deep Learning for Business,Yonsei University,course,https://www.coursera.org/learn/deep-learning-business,business/business-strategy
Fundraising and Development Foundations,"University of California, Davis",course,https://www.coursera.org/learn/fundraising-development,business/business-strategy
International Business Environment,University of London,course,https://www.coursera.org/learn/global-business-environment,business/business-strategy
Управление инновационными проектами,Moscow Institute of Physics and Technology,course,https://www.coursera.org/learn/innovacionnye-proekty,business/business-strategy
Budgeting essentials and development,Fundação Instituto de Administração,course,https://www.coursera.org/learn/budgeting-essentials-development,business/business-strategy
Mergers and Acquisitions – The Relentless Pursuit of Synergy,Moscow Institute of Physics and Technology,course,https://www.coursera.org/learn/mergers-and-acquisitions,business/business-strategy
Business Growth Strategy,University of Virginia,course,https://www.coursera.org/learn/uva-darden-business-growth-strategy,business/business-strategy
Global Strategy I: How The Global Economy Works,University of Illinois at Urbana-Champaign,course,https://www.coursera.org/learn/global-strategy,business/business-strategy
Strategy Implementation,Copenhagen Business School,course,https://www.coursera.org/learn/strategy-implementation,business/business-strategy
From Brand to Image: Creating High Impact Campaigns That Tell Brand Stories,IE Business School,course,https://www.coursera.org/learn/brand-image-high-impact-campaign,business/business-strategy
商务基础 (中文版),University of Pennsylvania,specialization,https://www.coursera.org/specializations/wharton-shangwu-jichu,business/business-strategy
Copyright Law in the Music Business,Berklee College of Music,course,https://www.coursera.org/learn/copyright-law-music-business,business/business-strategy
صياغة الأفكار المحفِّزة على الابتكار,University of Virginia,course,https://www.coursera.org/learn/uva-darden-design-thinking-innovation-ar,business/business-strategy
Business Analytics Capstone,University of Pennsylvania,course,https://www.coursera.org/learn/wharton-capstone-analytics,business/business-strategy
Customer Value in Pricing Strategy,University of Virginia,course,https://www.coursera.org/learn/uva-darden-bcg-pricing-strategy-customer-value,business/business-strategy
Микроэкономика (вводный курс),Moscow State Institute of International Relations (MGIMO) / МГИМО (Московский государственный институт международных отношений МИД России),course,https://www.coursera.org/learn/mikroekonomika-vvodnyy-kurs,business/business-strategy
Designing the Future of Work,UNSW Sydney (The University of New South Wales),course,https://www.coursera.org/learn/designing-future-of-work,business/business-strategy
