title,university,form,link,category
The Sun and the Total Eclipse of August 2017,University of Colorado Boulder,course,https://www.coursera.org/learn/eclipse,business/entrepreneurship
Mi nueva empresa: los siguientes pasos,Universidad de los Andes,course,https://www.coursera.org/learn/nueva-empresa,business/entrepreneurship
"Coding for Designers, Managers, & Entrepreneurs III",University of Virginia,course,https://www.coursera.org/learn/uva-coding-for-design-managers-3,business/entrepreneurship
"Coding for Designers, Managers, & Entrepreneurs II",University of Virginia,course,https://www.coursera.org/learn/uva-coding-for-design-managers-2,business/entrepreneurship
"Fundamentals of Negotiation, with Goldman Sachs 10,000 Women",Goldman Sachs,course,https://www.coursera.org/learn/10k-women-10,business/entrepreneurship
"Fundamentals of Funding, with Goldman Sachs 10,000 Women",Goldman Sachs,course,https://www.coursera.org/learn/10k-women-9,business/entrepreneurship
Capstone Course: Start Up Your Fintech Future,University of Cape Town,course,https://www.coursera.org/learn/startup-fintech-capstone,business/entrepreneurship
"Fundamentals of Customers and Competition, with Goldman Sachs 10,000 Women",Goldman Sachs,course,https://www.coursera.org/learn/10k-women-4,business/entrepreneurship
"Fundamentals of Financial Planning, with Goldman Sachs 10,000 Women",Goldman Sachs,course,https://www.coursera.org/learn/10k-women-5,business/entrepreneurship
