title,university,form,link,category
Copyright Law,University of Pennsylvania,course,https://www.coursera.org/learn/copyright-law,business/business-strategy
Coberturas de riesgo con futuros y opciones para agrobusiness,Universidad Austral,course,https://www.coursera.org/learn/coberturas-de-riesgo,business/business-strategy
"Anticipating Your Next Battle, in Business and Beyond",HEC Paris,course,https://www.coursera.org/learn/anticipate,business/business-strategy
Doing Business in China,The Chinese University of Hong Kong,specialization,https://www.coursera.org/specializations/doing-business-in-china,business/business-strategy
الذكاء الاصطناعي للجميع,deeplearning.ai,course,https://www.coursera.org/learn/ai-for-everyone-ar,business/business-strategy
Introduction to Supply Chain Finance & Blockchain Technology,New York Institute of Finance,course,https://www.coursera.org/learn/introduction-supply-chain-finance-blockchain-technology,business/business-strategy
Adapt your leadership style,Macquarie University,course,https://www.coursera.org/learn/leadership-adapt-your-style,business/business-strategy
Green Business Strategy,The Hong Kong University of Science and Technology,course,https://www.coursera.org/learn/green-business-strategy,business/business-strategy
Supply chain management: Be global,Macquarie University,course,https://www.coursera.org/learn/supply-chain-management-global,business/business-strategy
Marketing Strategy for Entrepreneurs,EIT Digital,course,https://www.coursera.org/learn/marketing-strategy-entrepreneurs,business/business-strategy
Introducción a la Calidad,Universidad Nacional Autónoma de México,course,https://www.coursera.org/learn/gestion-de-productividad,business/business-strategy
Introducción a la Estrategia,Universidad Nacional Autónoma de México,course,https://www.coursera.org/learn/introduccionalaestrategia,business/business-strategy
Introducción a las Finanzas Corporativas,University of Pennsylvania,course,https://www.coursera.org/learn/wharton-finanzas-corporativas,business/business-strategy
Google Cloud Product Fundamentals,Google Cloud,course,https://www.coursera.org/learn/google-cloud-product-fundamentals,business/business-strategy
Patent Law,University of Pennsylvania,course,https://www.coursera.org/learn/patents,business/business-strategy
"Visionary leadership, identity & motivation: Become a meaning maker",Macquarie University,course,https://www.coursera.org/learn/visionary-leadership-meaning-maker,business/business-strategy
Supply Chain Management Strategy,Rutgers the State University of New Jersey,course,https://www.coursera.org/learn/supply-chain-management-strategy,business/business-strategy
Uso de técnicas estadísticas para el análisis de datos,Tecnológico de Monterrey,course,https://www.coursera.org/learn/datos-tecnicas,business/business-strategy
Leadership Through Marketing,Northwestern University,course,https://www.coursera.org/learn/leadership-marketing,business/business-strategy
Marketing analytics: Know your customers,Macquarie University,course,https://www.coursera.org/learn/marketing-analytics-customers,business/business-strategy
Cybersecurity and Mobility,University System of Georgia,course,https://www.coursera.org/learn/cybersecurity-mobility,business/business-strategy
Business of Games and Entrepreneurship,Michigan State University,course,https://www.coursera.org/learn/gamedev-business,business/business-strategy
Transacting on the Blockchain,INSEAD,course,https://www.coursera.org/learn/transacting-blockchain,business/business-strategy
FinTech Risk Management,The Hong Kong University of Science and Technology,course,https://www.coursera.org/learn/fintech-risk-management,business/business-strategy
Introducción a la Gestión de Operaciones,University of Pennsylvania,course,https://www.coursera.org/learn/wharton-gestion-operaciones,business/business-strategy
Capital Markets and Financial Institutions – How to Survive Them,Moscow Institute of Physics and Technology,course,https://www.coursera.org/learn/capital-markets-and-financial-institutions,business/business-strategy
Giving 2.0: The MOOC,Stanford University,course,https://www.coursera.org/learn/philanthropist,business/business-strategy
Gestão de Marca & Crise de Imagem,Fundação Instituto de Administração,course,https://www.coursera.org/learn/gestao-de-marca-crise-imagem,business/business-strategy
Sales Strategy,Fundação Instituto de Administração,course,https://www.coursera.org/learn/sales-strategy,business/business-strategy
التحوّل الرقمي,BCG,course,https://www.coursera.org/learn/bcg-uva-darden-digital-transformation-ar,business/business-strategy
Маркетинг. Часть 2. Инструментарий маркетинга,Peter the Great St. Petersburg Polytechnic University,course,https://www.coursera.org/learn/marketing-instrumentarij,business/business-strategy
FinTech Security and Regulation (RegTech),The Hong Kong University of Science and Technology,course,https://www.coursera.org/learn/regtech,business/business-strategy
Today’s Music Industry,West Virginia University,course,https://www.coursera.org/learn/music-industry,business/business-strategy
Website Optimization Client Report Project,"University of California, Davis",course,https://www.coursera.org/learn/seo-project,business/business-strategy
Valuation for Startups Using Discounted Cash Flows Approach,Yonsei University,course,https://www.coursera.org/learn/discounted-cash-flow,business/business-strategy
Marketing: Customer Needs and Wants,IESE Business School,course,https://www.coursera.org/learn/marketing-customers,business/business-strategy
"Empresa familiar: gestión, dirección y sucesión",ESADE Business and Law School,specialization,https://www.coursera.org/specializations/empresa-familiar-gestion,business/business-strategy
¿Cómo construir mi modelo de negocio?,Universidad de los Andes,course,https://www.coursera.org/learn/modelo-negocio,business/business-strategy
Protecting Business Innovations via Copyright,The Hong Kong University of Science and Technology,course,https://www.coursera.org/learn/protect-business-innovations-copyright,business/business-strategy
Industrial Organization: Strategy and Competition in Business,National Research University Higher School of Economics,course,https://www.coursera.org/learn/industrial-organization,business/business-strategy
"服務模式的體驗、設計與創新：從痛點到賣點 (Experience, Design, and Innovation of Service Models: from Pain Points to Selling Points)",National Taiwan University,course,https://www.coursera.org/learn/service-models,business/business-strategy
Advanced Competitive Strategy,Ludwig-Maximilians-Universität München (LMU),course,https://www.coursera.org/learn/advanced-competitive-strategy,business/business-strategy
Moving to the Cloud,The University of Melbourne,course,https://www.coursera.org/learn/cloud-computing-adoption,business/business-strategy
Content Strategy for Professionals: Managing Content,Northwestern University,course,https://www.coursera.org/learn/content-management-strategy,business/business-strategy
Infonomics I: Business Information Economics and Data Monetization,University of Illinois at Urbana-Champaign,course,https://www.coursera.org/learn/infonomics-1,business/business-strategy
Protecting Business Innovations via Patent,The Hong Kong University of Science and Technology,course,https://www.coursera.org/learn/protect-business-innovations-patent,business/business-strategy
Global sustainability and corporate social responsibility: Be sustainable,Macquarie University,course,https://www.coursera.org/learn/global-sustainability-be-sustainable,business/business-strategy
Recolección y exploración de datos,Tecnológico de Monterrey,course,https://www.coursera.org/learn/ordenamiento-datos,business/business-strategy
International Business II,University of New Mexico,course,https://www.coursera.org/learn/international-business-2,business/business-strategy
La Philanthropie : Comprendre et Agir,ESSEC Business School,course,https://www.coursera.org/learn/philanthropie,business/business-strategy
La gestión en la empresa familiar,ESADE Business and Law School,course,https://www.coursera.org/learn/gestion-empresa-familiar,business/business-strategy
Innovation Strategy: Developing Your Fintech strategy,Copenhagen Business School,course,https://www.coursera.org/learn/innovation-strategy-fintech,business/business-strategy
Protecting Business Innovations via Trademark,The Hong Kong University of Science and Technology,course,https://www.coursera.org/learn/protect-business-innovations-trademark,business/business-strategy
A Scientific Approach to Innovation Management,Università Bocconi,course,https://www.coursera.org/learn/scientific-approach-innovation-management,business/business-strategy
Doing Business in Europe,ESCP Business School,course,https://www.coursera.org/learn/doing-business-in-europe,business/business-strategy
Strategic Organization Design,Ludwig-Maximilians-Universität München (LMU),course,https://www.coursera.org/learn/organization-design,business/business-strategy
Blockchain Opportunity Analysis,INSEAD,course,https://www.coursera.org/learn/blockchain-opportunity-analysis,business/business-strategy
Мировая экономика,Moscow State Institute of International Relations (MGIMO) / МГИМО (Московский государственный институт международных отношений МИД России),specialization,https://www.coursera.org/specializations/mirovaya-ekonomika,business/business-strategy
Hacer negocios con multinacionales y empresas en América Latina,Universidad de los Andes,course,https://www.coursera.org/learn/negocios-multinacionales-america-latina,business/business-strategy
Demand management: Breaking down today’s commercial silos,ESSEC Business School,course,https://www.coursera.org/learn/demandmanagement,business/business-strategy
Wharton Business Foundations Capstone,University of Pennsylvania,course,https://www.coursera.org/learn/wharton-capstone,business/business-strategy
Государственно-частное партнерство в инфраструктурном развитии России,Moscow State Institute of International Relations (MGIMO) / МГИМО (Московский государственный институт международных отношений МИД России),course,https://www.coursera.org/learn/gosudarstvenno-chastnoye-partnerstvo,business/business-strategy
Selling to Chinese Consumers,The Chinese University of Hong Kong,course,https://www.coursera.org/learn/selling-to-chinese-consumers,business/business-strategy
What’s Your Big Idea?,The University of North Carolina at Chapel Hill,course,https://www.coursera.org/learn/big-ideas,business/business-strategy
市场营销概论 (中文版）,University of Pennsylvania,course,https://www.coursera.org/learn/wharton-shichang-ying-xiao,business/business-strategy
Negocios Internacionales II,University of New Mexico,course,https://www.coursera.org/learn/negocios-internacionales-2,business/business-strategy
Global Strategy II: Doing Business in The Global Economy,University of Illinois at Urbana-Champaign,course,https://www.coursera.org/learn/global-strategy-two,business/business-strategy
Research Report: Delivering Insights,"University of California, Davis",course,https://www.coursera.org/learn/marketing-research-report,business/business-strategy
Sales Training: Sales Team Management,HubSpot Academy,course,https://www.coursera.org/learn/sales-team-management,business/business-strategy
The Impact of Technology,EIT Digital,course,https://www.coursera.org/learn/impact-of-technology,business/business-strategy
Entrepreneurship,The Chinese University of Hong Kong,course,https://www.coursera.org/learn/entrepreneurship,business/business-strategy
竞争策略（中文版）,Ludwig-Maximilians-Universität München (LMU),course,https://www.coursera.org/learn/competitivestrategyzh,business/business-strategy
Introducción a la Contabilidad Financiera,University of Pennsylvania,course,https://www.coursera.org/learn/wharton-contabilidad-financiera,business/business-strategy
Business Model Innovation for Sustainable Landscape Restoration,Erasmus University Rotterdam,course,https://www.coursera.org/learn/bmi-sustainable-landscape-restoration,business/business-strategy
Business Strategy in Practice (Project-centered Course),University of Virginia,course,https://www.coursera.org/learn/uva-darden-business-strategy-capstone,business/business-strategy
Financial Analysis for Startups,Yonsei University,course,https://www.coursera.org/learn/financial-ratios,business/business-strategy
Content Strategy for Professionals: Ensuring Your Content's Impact,Northwestern University,course,https://www.coursera.org/learn/effective-content-strategy,business/business-strategy
Content Strategy for Professionals: Expanding Your Content’s Reach,Northwestern University,course,https://www.coursera.org/learn/increase-reach,business/business-strategy
财务会计概论（中文版）,University of Pennsylvania,course,https://www.coursera.org/learn/wharton-kuaiji,business/business-strategy
Мировая экономика. Основы,Moscow State Institute of International Relations (MGIMO) / МГИМО (Московский государственный институт международных отношений МИД России),course,https://www.coursera.org/learn/mirovaya-ekonomika-osnovy,business/business-strategy
商管研究中的賽局分析（一）：通路選擇、合約制定與共享經濟 (Game Theoretic Analysis for Business Research (1)),National Taiwan University,course,https://www.coursera.org/learn/gabr,business/business-strategy
Sales Training: Inbound Business Strategy,HubSpot Academy,course,https://www.coursera.org/learn/inbound-business-strategy,business/business-strategy
Sales & Marketing Alignment,Fundação Instituto de Administração,course,https://www.coursera.org/learn/sales-marketing-alignment,business/business-strategy
Gestión del alcance: el qué de la triple restricción,Universidad de los Andes,course,https://www.coursera.org/learn/gestion-alcance-proyectos,business/business-strategy
Building the Business Model for Corporate Entrepreneurs,"University of Maryland, College Park",course,https://www.coursera.org/learn/corporate-entrepreneurs-business-model,business/business-strategy
Современные практики бирюзового управления,E-Learning Development Fund,course,https://www.coursera.org/learn/teal-management-practices,business/business-strategy
Business Application of Machine Learning and Artificial Intelligence in Healthcare,Northeastern University,course,https://www.coursera.org/learn/artificialintelligence-in-healthcare,business/business-strategy
賽局與產業競爭策略 (Game Theory and Business Strategy),National Taiwan University,course,https://www.coursera.org/learn/game-theory-and-business-strategy,business/business-strategy
Машинное обучение для руководителей,E-Learning Development Fund,course,https://www.coursera.org/learn/mashinnoye-obucheniye-dlya-rukovoditeley,business/business-strategy
Strategic management: Be competitive,Macquarie University,course,https://www.coursera.org/learn/strategic-management-be-competitive,business/business-strategy
Healthcare Consumerism and Implication for Care Delivery,Northeastern University,course,https://www.coursera.org/learn/healthcareconsumerism,business/business-strategy
Strategic Management - Capstone Project,Copenhagen Business School,course,https://www.coursera.org/learn/businesscap,business/business-strategy
A prática da gestão de clubes e federações esportivas,Fundação Instituto de Administração,course,https://www.coursera.org/learn/fia-gestao-clubes-federacoes-esportivas,business/business-strategy
Protecting Business Innovations via Strategy,The Hong Kong University of Science and Technology,course,https://www.coursera.org/learn/protect-business-innovations-strategy,business/business-strategy
Digital Transformation of Financial Services - Capstone Project,Copenhagen Business School,course,https://www.coursera.org/learn/digital-transformation-financial-services-project,business/business-strategy
Major and Principal Gifts,"University of California, Davis",course,https://www.coursera.org/learn/major-principal-gifts,business/business-strategy
Models & Frameworks to Support Sales Planning,Fundação Instituto de Administração,course,https://www.coursera.org/learn/models-frameworks-support-sales-planning,business/business-strategy
More on Change and Sustainability,University of Colorado System,course,https://www.coursera.org/learn/business-case-sustainability,business/business-strategy
Sustainable Business Enterprises,University of Illinois at Urbana-Champaign,course,https://www.coursera.org/learn/sustainable-business-enterprises,business/business-strategy
Разработка корпоративных систем. Часть 2. Строгие методологии разработки,National Research Nuclear University MEPhI,course,https://www.coursera.org/learn/strogie-metodologii-razrabotki,business/business-strategy
Nouveaux modèles économiques des associations,ESSEC Business School,course,https://www.coursera.org/learn/nouveaux-modeles-economiques-associations,business/business-strategy
Future Healthcare Payment Models,Northeastern University,course,https://www.coursera.org/learn/healthcare-payment-models,business/business-strategy
Intellectual Property in the Healthcare Industry,University of Pennsylvania,course,https://www.coursera.org/learn/intellectual-property-healthcare-industry,business/business-strategy
Valuation for Startups Using Multiple Approach,Yonsei University,course,https://www.coursera.org/learn/valuation-multiples,business/business-strategy
企业金融概论（中文版）,University of Pennsylvania,course,https://www.coursera.org/learn/wharton-qiye-jinrong,business/business-strategy
FinTech Disruptive Innovation: Implications for Society,The Hong Kong University of Science and Technology,course,https://www.coursera.org/learn/fintech-disruption,business/business-strategy
Building Fintech Startups in Emerging Markets,University of Cape Town,course,https://www.coursera.org/learn/building-fintech-startups,business/business-strategy
إستراتيجية الأعمال المتقدمة,University of Virginia,course,https://www.coursera.org/learn/uva-darden-advanced-business-strategy-ar,business/business-strategy
Blockchain for the decision maker,EIT Digital,course,https://www.coursera.org/learn/blockchain-decision-maker,business/business-strategy
Цифровые технологии в международных финансах,Moscow State Institute of International Relations (MGIMO) / МГИМО (Московский государственный институт международных отношений МИД России),course,https://www.coursera.org/learn/cifrovye-tekhnologii-v-mezhdunarodnyh-finansah,business/business-strategy
Research kitchen,Ludwig-Maximilians-Universität München (LMU),course,https://www.coursera.org/learn/research-kitchen,business/business-strategy
Capstone Project: Business Technology Management,Indian School of Business,course,https://www.coursera.org/learn/business-tech-project,business/business-strategy
"Grow to Greatness: Smart Growth for Private Businesses, Part II",University of Virginia,course,https://www.coursera.org/learn/uva-darden-smart-growth-strategy-2,business/business-strategy
Annual Campaigns: Building a Case for Support,"University of California, Davis",course,https://www.coursera.org/learn/annual-campaigns,business/business-strategy
Aplicando el análisis de datos: casos selectos,Tecnológico de Monterrey,course,https://www.coursera.org/learn/analisis-de-datos-aplicaciones,business/business-strategy
Business Implications of AI: Full course,EIT Digital,course,https://www.coursera.org/learn/business-implications-ai,business/business-strategy
Core Concepts of Accounting – Numbers and People,Moscow Institute of Physics and Technology,course,https://www.coursera.org/learn/core-concepts-of-accounting,business/business-strategy
"Sustainable Business: Big Issues, Big Changes",University of Colorado System,course,https://www.coursera.org/learn/sustainable-business-changes,business/business-strategy
China Strategy,The Chinese University of Hong Kong,course,https://www.coursera.org/learn/china-strategy,business/business-strategy
Разработка корпоративных систем. Часть 3. Гибкие методологии разработки,National Research Nuclear University MEPhI,course,https://www.coursera.org/learn/gibkie-metodologii-razrabotki,business/business-strategy
Organizational Leadership Capstone,Northwestern University,course,https://www.coursera.org/learn/leadership-capstone,business/business-strategy
Hôtel “De l'étoile” - a hotel in crisis?,ESSEC Business School,course,https://www.coursera.org/learn/hotel-management-project,business/business-strategy
Bases of the law of obligations (The Russian Federation) Part 1,Moscow State Institute of International Relations (MGIMO) / МГИМО (Московский государственный институт международных отношений МИД России),course,https://www.coursera.org/learn/russian-law-of-obligations,business/business-strategy
运营管理概论（中文版）,University of Pennsylvania,course,https://www.coursera.org/learn/wharton-yunying-guanli,business/business-strategy
Standardisation & Technology,EIT Digital,course,https://www.coursera.org/learn/standardisation,business/business-strategy
すべての人のためのAI【日本語版】,deeplearning.ai,course,https://www.coursera.org/learn/ai-for-everyone-ja,business/business-strategy
"Инженер - менеджер настоящего, системный архитектор будущего",Moscow Institute of Physics and Technology,course,https://www.coursera.org/learn/systems-engineering-5,business/business-strategy
Разработка корпоративных систем. Часть 1. Модели жизненного цикла,National Research Nuclear University MEPhI,course,https://www.coursera.org/learn/razrabotka-korporativnih-sistem-modeli-jiznennogo-cikla,business/business-strategy
Infonomics II: Business Information Management and Measurement,University of Illinois at Urbana-Champaign,course,https://www.coursera.org/learn/infonomics-2,business/business-strategy
Modelos de empresa familiar: del capitán al grupo inversor,ESADE Business and Law School,course,https://www.coursera.org/learn/modelos-de-empresa-familiar,business/business-strategy
Мировая экономика. Ведущие страны - участники,Moscow State Institute of International Relations (MGIMO) / МГИМО (Московский государственный институт международных отношений МИД России),course,https://www.coursera.org/learn/uchastniki-mirovaya-ekonomika-vedushchiye-strany,business/business-strategy
Planned Giving,"University of California, Davis",course,https://www.coursera.org/learn/planned-giving,business/business-strategy
"Technology Commercialization, Part 1: Setting up your Idea Filtering System",University of Rochester,course,https://www.coursera.org/learn/technology-commercialization,business/business-strategy
Applying Investment Decision Rules for Startups,Yonsei University,course,https://www.coursera.org/learn/capital-budgeting,business/business-strategy
Evaluating the Quality of Healthcare Delivery,Northeastern University,course,https://www.coursera.org/learn/quality-of-healthcare,business/business-strategy
Strategic Sales Management Final Project,Fundação Instituto de Administração,course,https://www.coursera.org/learn/ssm-final-project,business/business-strategy
Innovation: From Creativity to Entrepreneurship Capstone,University of Illinois at Urbana-Champaign,course,https://www.coursera.org/learn/innovation-creativity-entrepreneurship-capstone,business/business-strategy
مقاييس الأعمال للشركات التي تعتمد على البيانات,Duke University,course,https://www.coursera.org/learn/analytics-business-metrics-ar,business/business-strategy
Content Strategy for Professionals: Capstone Project,Northwestern University,course,https://www.coursera.org/learn/content-strategy-project,business/business-strategy
Мировая экономика. Субъекты и ресурсы.,Moscow State Institute of International Relations (MGIMO) / МГИМО (Московский государственный институт международных отношений МИД России),course,https://www.coursera.org/learn/mirovaya-ekonomika-subyekty-resursy,business/business-strategy
Capstone: Create Value from Open Data,ESSEC Business School,course,https://www.coursera.org/learn/strategic-business-analytics-capstone,business/business-strategy
Mi nueva empresa: los siguientes pasos,Universidad de los Andes,course,https://www.coursera.org/learn/nueva-empresa,business/business-strategy
"La familia empresaria: individuo, dinámica y tiempo",ESADE Business and Law School,course,https://www.coursera.org/learn/familia-empresaria,business/business-strategy
Business Implications of AI: A Nano-course,EIT Digital,course,https://www.coursera.org/learn/business-implications-ai-nano-course,business/business-strategy
