title,university,form,link,category
高阶竞争策略（中文版）,Ludwig-Maximilians-Universität München (LMU),course,https://www.coursera.org/learn/advanced-competitive-strategy-zh,business/business-strategy
Impact from digital transformation: A Nano course,EIT Digital,course,https://www.coursera.org/learn/digital-transformation-impact-nano-course,business/business-strategy
Análisis de Datos - Proyecto Final,Tecnológico de Monterrey,course,https://www.coursera.org/learn/analisis-datos-proyecto-final,business/business-strategy
Competitive Strategy and Organization Design Project,Ludwig-Maximilians-Universität München (LMU),course,https://www.coursera.org/learn/organization-strategy-project,business/business-strategy
Doing Business in China Capstone,The Chinese University of Hong Kong,course,https://www.coursera.org/learn/doing-business-in-china-capstone,business/business-strategy
Valuation and Financial Analysis For Startups Capstone,Yonsei University,course,https://www.coursera.org/learn/valuation-for-startups-project,business/business-strategy
Análise de oportunidade de Blockchain,INSEAD,course,https://www.coursera.org/learn/analise-oportunidade-blockchain,business/business-strategy
Value Creation: The Carlson-Polizzotto Method,Northeastern University,course,https://www.coursera.org/learn/valuecreation,business/business-strategy
Capstone Project – Analyzing a Real Transaction,Moscow Institute of Physics and Technology,course,https://www.coursera.org/learn/capstone-project-analyzing-a-real-transaction,business/business-strategy
