title,university,form,link,category
English for Business and Entrepreneurship,University of Pennsylvania,course,https://www.coursera.org/learn/business,business/entrepreneurship
Design Thinking for Innovation,University of Virginia,course,https://www.coursera.org/learn/uva-darden-design-thinking-innovation,business/entrepreneurship
Gestión Empresarial Exitosa para Pymes,Pontificia Universidad Católica de Chile,course,https://www.coursera.org/learn/gestionempresarialpyme,business/entrepreneurship
Entrepreneurship,University of Pennsylvania,specialization,https://www.coursera.org/specializations/wharton-entrepreneurship,business/entrepreneurship
"Brand Management: Aligning Business, Brand and Behaviour",University of London,course,https://www.coursera.org/learn/brand,business/entrepreneurship
The DIY Musician,Berklee College of Music,specialization,https://www.coursera.org/specializations/diy-musician,business/entrepreneurship
Diseño y Creación de un Emprendimiento Social,Pontificia Universidad Católica de Chile,course,https://www.coursera.org/learn/emprendimiento-social-negocios-sustentable-canvas-sociales,business/entrepreneurship
How To Create a Website in a Weekend! (Project-Centered Course),The State University of New York,course,https://www.coursera.org/learn/how-to-create-a-website,business/entrepreneurship
Becoming a changemaker: Introduction to Social Innovation,University of Cape Town,course,https://www.coursera.org/learn/social-innovation,business/entrepreneurship
Design: Creation of Artifacts in Society,University of Pennsylvania,course,https://www.coursera.org/learn/design,business/entrepreneurship
UX / UI: Fundamentos para o design de interface,Universidade de São Paulo,course,https://www.coursera.org/learn/ux-ui-design-de-interface,business/entrepreneurship
Criação de Startups: Como desenvolver negócios inovadores,Universidade de São Paulo,course,https://www.coursera.org/learn/criacao-startups,business/entrepreneurship
Desarrollo rápido de productos innovadores para mercados emergentes,Tecnológico de Monterrey,course,https://www.coursera.org/learn/innovacion,business/entrepreneurship
Devenir entrepreneur du changement,HEC Paris,course,https://www.coursera.org/learn/entrepreneur-changement,business/entrepreneurship
Entrepreneurship 2: Launching your Start-Up,University of Pennsylvania,course,https://www.coursera.org/learn/wharton-launching-startup,business/entrepreneurship
Social Impact Strategy: Tools for Entrepreneurs and Innovators,University of Pennsylvania,course,https://www.coursera.org/learn/social-impact,business/entrepreneurship
Consolidando empresas: Estrutura jurídica e financeira,Universidade de São Paulo,course,https://www.coursera.org/learn/consolidando-empresas,business/entrepreneurship
Patrocinio Deportivo,Universitat Autònoma de Barcelona,course,https://www.coursera.org/learn/patrocinio-deportivo,business/entrepreneurship
Entrepreneurship: Launching an Innovative Business,"University of Maryland, College Park",specialization,https://www.coursera.org/specializations/business-entrepreneurship,business/entrepreneurship
Cryptocurrency and Blockchain: An Introduction to Digital Currencies,University of Pennsylvania,course,https://www.coursera.org/learn/wharton-cryptocurrency-blockchain-introduction-digital-currency,business/entrepreneurship
Цифровой SMM-проект: виртуальная платформа для бизнес-коммуникаций,National Research Tomsk State University,specialization,https://www.coursera.org/specializations/digital-smm,business/entrepreneurship
Finanzas corporativas,Universidad Nacional Autónoma de México,specialization,https://www.coursera.org/specializations/finanzascorporativas,business/entrepreneurship
Entrepreneurial Finance: Strategy and Innovation,Duke University,specialization,https://www.coursera.org/specializations/entrepreneurial-finance,business/entrepreneurship
Renewable Energy and Green Building Entrepreneurship,Duke University,course,https://www.coursera.org/learn/renewable-energy-entrepreneurship,business/entrepreneurship
3D Printing Software,University of Illinois at Urbana-Champaign,course,https://www.coursera.org/learn/3d-printing-software,business/entrepreneurship
Entrepreneurship 3: Growth Strategies,University of Pennsylvania,course,https://www.coursera.org/learn/growth-strategy,business/entrepreneurship
Design Thinking,HEC Paris,course,https://www.coursera.org/learn/design-thinking-innovation,business/entrepreneurship
"Основы SMM: тренды, аудитории, платформы",National Research Tomsk State University,course,https://www.coursera.org/learn/tsu-smm-osnovy,business/entrepreneurship
Системное мышление,Moscow Institute of Physics and Technology,course,https://www.coursera.org/learn/system-thinking,business/entrepreneurship
How to Finance and Grow Your Startup – Without VC,University of London,course,https://www.coursera.org/learn/startup-financing-without-vc,business/entrepreneurship
The 3D Printing Revolution,University of Illinois at Urbana-Champaign,course,https://www.coursera.org/learn/3d-printing-revolution,business/entrepreneurship
Business Model Canvas: A Tool for Entrepreneurs and Innovators (Project-Centered Course),University System of Georgia,course,https://www.coursera.org/learn/business-model-canvas,business/entrepreneurship
"Innovation Through Design: Think, Make, Break, Repeat",The University of Sydney,course,https://www.coursera.org/learn/innovation-through-design,business/entrepreneurship
Business Model Innovation,HEC Paris,course,https://www.coursera.org/learn/business-model,business/entrepreneurship
Boosting Creativity for Innovation,HEC Paris,course,https://www.coursera.org/learn/boosting-creativity-innovation,business/entrepreneurship
Startup Valuation Methods,Duke University,course,https://www.coursera.org/learn/startup-valuation-methods,business/entrepreneurship
Essentials of Entrepreneurship: Thinking & Action,"University of California, Irvine",course,https://www.coursera.org/learn/entrepreneurial-thinking,business/entrepreneurship
Programa en Desarrollo de nuevas empresas,Universidad de los Andes,specialization,https://www.coursera.org/specializations/desarrollo-nuevas-empresas,business/entrepreneurship
O Empreendedorismo e as Competências do Empreendedor,Universidade Estadual de Campinas,course,https://www.coursera.org/learn/empreendedorismo,business/entrepreneurship
Entrepreneurship 4: Financing and Profitability,University of Pennsylvania,course,https://www.coursera.org/learn/wharton-entrepreneurship-financing-profitabilty,business/entrepreneurship
Startup Entrepreneurship,Technion - Israel Institute of Technology,specialization,https://www.coursera.org/specializations/startup-entrepreneurship,business/entrepreneurship
Innovation for Entrepreneurs: From Idea to Marketplace,"University of Maryland, College Park",course,https://www.coursera.org/learn/innovative-entrepreneur,business/entrepreneurship
Sport Sponsorship. Let them Play,Universitat Autònoma de Barcelona,course,https://www.coursera.org/learn/sport-sponsorship,business/entrepreneurship
How to Start Your Own Business,Michigan State University,specialization,https://www.coursera.org/specializations/start-your-own-business,business/entrepreneurship
Crowdfunding,University of Pennsylvania,course,https://www.coursera.org/learn/wharton-crowdfunding,business/entrepreneurship
Administración Estratégica y Emprendedora,University of New Mexico,course,https://www.coursera.org/learn/administracion-estrategica,business/entrepreneurship
Organizational Design and Management,HEC Paris,course,https://www.coursera.org/learn/organizational-design-management,business/entrepreneurship
Créer et développer une startup technologique,École Polytechnique,course,https://www.coursera.org/learn/startup-technologique,business/entrepreneurship
Value Creation Through Innovation,EIT Digital,specialization,https://www.coursera.org/specializations/value-creation-innovation,business/entrepreneurship
New Product Development - develop your own new product,Technion - Israel Institute of Technology,course,https://www.coursera.org/learn/new-product-development,business/entrepreneurship
Developing Innovative Ideas for New Companies: The First Step in Entrepreneurship,"University of Maryland, College Park",course,https://www.coursera.org/learn/innovative-ideas,business/entrepreneurship
¿Cómo convertir mi idea en empresa?,Universidad de los Andes,course,https://www.coursera.org/learn/idea-empresa,business/entrepreneurship
Cracking the Creativity Code: Discovering Ideas,Technion - Israel Institute of Technology,course,https://www.coursera.org/learn/startup-entrepreneurship-discovering-ideas,business/entrepreneurship
Интернет-предпринимательство,Moscow Institute of Physics and Technology,course,https://www.coursera.org/learn/internet-predprinimatelstvo,business/entrepreneurship
Legal Tech & Startups,IE Business School,course,https://www.coursera.org/learn/legal-tech-startups,business/entrepreneurship
Developing An Entrepreneurial Mindset: First Step Towards Success,Michigan State University,course,https://www.coursera.org/learn/entrepreneurial-mindset,business/entrepreneurship
Emprender la emprendeduría,Universitat de Barcelona,course,https://www.coursera.org/learn/emprender,business/entrepreneurship
Entrepreneurship I: Laying the Foundation,University of Illinois at Urbana-Champaign,course,https://www.coursera.org/learn/entrepreneurship-1,business/entrepreneurship
How to Validate your Startup Idea,UNSW Sydney (The University of New South Wales),course,https://www.coursera.org/learn/startup-idea,business/entrepreneurship
3D Printing Applications,University of Illinois at Urbana-Champaign,course,https://www.coursera.org/learn/3d-printing-applications,business/entrepreneurship
Health Care Innovation,University of Pennsylvania,course,https://www.coursera.org/learn/wo-pmo-healthcareinnovation,business/entrepreneurship
Patenting in Biotechnology,Technical University of Denmark (DTU),course,https://www.coursera.org/learn/patenting-bio-ipr,business/entrepreneurship
Entreprendre dans les Industries Culturelles à l'ère du numérique,Sciences Po,course,https://www.coursera.org/learn/entreprendre-culture,business/entrepreneurship
Building Your Career in Music: Developing A Brand and Funding Your Music,Berklee College of Music,course,https://www.coursera.org/learn/navigate-music-industry-independent-artist,business/entrepreneurship
Social Entrepreneurship,Copenhagen Business School,specialization,https://www.coursera.org/specializations/social-entrepreneurship-cbs,business/entrepreneurship
Creativity Toolkit I: Changing Perspectives,University of Illinois at Urbana-Champaign,course,https://www.coursera.org/learn/creativity-toolkit-1,business/entrepreneurship
Creating and Developing a Tech Startup,École Polytechnique,course,https://www.coursera.org/learn/tech-startup,business/entrepreneurship
Fintech Startups in Emerging Markets,University of Cape Town,specialization,https://www.coursera.org/specializations/fintech-startups-emerging-markets,business/entrepreneurship
صياغة الأفكار المحفِّزة على الابتكار,University of Virginia,course,https://www.coursera.org/learn/uva-darden-design-thinking-innovation-ar,business/entrepreneurship
3D Printing Hardware,University of Illinois at Urbana-Champaign,course,https://www.coursera.org/learn/3d-print-hardware,business/entrepreneurship
Local Economic Development,Erasmus University Rotterdam,course,https://www.coursera.org/learn/local-economic-development,business/entrepreneurship
Lean Software Development,University of Minnesota,course,https://www.coursera.org/learn/lean-software-development,business/entrepreneurship
Innovative Finance: Hacking finance to change the world,University of Cape Town,course,https://www.coursera.org/learn/innovative-finance,business/entrepreneurship
Effectuation : l'entrepreneuriat pour tous,emlyon business school,course,https://www.coursera.org/learn/effectuation,business/entrepreneurship
«Стартап: как вырасти в успешный бизнес»,Saint Petersburg State University,course,https://www.coursera.org/learn/startup-spbu,business/entrepreneurship
Innovating in a Digital World,Institut Mines-Télécom,course,https://www.coursera.org/learn/innovating-digital-world,business/entrepreneurship
Doing Business in China,The Chinese University of Hong Kong,specialization,https://www.coursera.org/specializations/doing-business-in-china,business/entrepreneurship
Challenges of Agribusiness Management,Università Bocconi,course,https://www.coursera.org/learn/agribusiness-management-challenges,business/entrepreneurship
Understanding the Music Business: What is Music Worth?,Vanderbilt University,course,https://www.coursera.org/learn/musicbiz,business/entrepreneurship
New Venture Finance: Startup Funding for Entrepreneurs,"University of Maryland, College Park",course,https://www.coursera.org/learn/startup-funding,business/entrepreneurship
Corporate Entrepreneurship: Innovating within Corporations,"University of Maryland, College Park",specialization,https://www.coursera.org/specializations/corporate-entrepreneurship,business/entrepreneurship
"Социальные медиа: маркетинговые инструменты, сервисы и SMM-активности",National Research Tomsk State University,course,https://www.coursera.org/learn/tsu-sotsialnie-media,business/entrepreneurship
Identifying Social Entrepreneurship Opportunities,Copenhagen Business School,course,https://www.coursera.org/learn/social-entrepreneurship-opportunities,business/entrepreneurship
Emprendiendo en STEM,Universidad Austral,course,https://www.coursera.org/learn/emprendiendo-en-stem,business/entrepreneurship
L'entrepreneuriat social : de l'envie au projet,ESSEC Business School,course,https://www.coursera.org/learn/entrepreneuriatquichangelemonde,business/entrepreneurship
Технологическое предпринимательство,Moscow Institute of Physics and Technology,course,https://www.coursera.org/learn/tekhnologicheskoe-predprinimatelstvo,business/entrepreneurship
Social Entrepreneurship,University of Pennsylvania,course,https://www.coursera.org/learn/wharton-social-entrepreneurship,business/entrepreneurship
¿Cómo construir mi modelo de negocio?,Universidad de los Andes,course,https://www.coursera.org/learn/modelo-negocio,business/entrepreneurship
Leading Innovation in Arts and Culture,Vanderbilt University,course,https://www.coursera.org/learn/arts-culture-innovation,business/entrepreneurship
From Idea to Startup,Technion - Israel Institute of Technology,course,https://www.coursera.org/learn/startup-entrepreneurship-from-idea-to-startup,business/entrepreneurship
"SMM-кампания: цели, стратегия, алгоритмы и маркетинговый потенциал",National Research Tomsk State University,course,https://www.coursera.org/learn/tsu-smm-campaniya,business/entrepreneurship
Hacer negocios en América Latina,Pontificia Universidad Católica de Chile,specialization,https://www.coursera.org/specializations/business-latin-america,business/entrepreneurship
Évaluation & Mesure d'Impact Social,ESSEC Business School,course,https://www.coursera.org/learn/evaluation-mesure-impact-social,business/entrepreneurship
Разработка инновационного продукта,Moscow Institute of Physics and Technology,course,https://www.coursera.org/learn/developing-products-new-market,business/entrepreneurship
Protecting Business Innovations via Patent,The Hong Kong University of Science and Technology,course,https://www.coursera.org/learn/protect-business-innovations-patent,business/entrepreneurship
"L'impact investing, la finance qui change le monde",ESSEC Business School,specialization,https://www.coursera.org/specializations/impact-investing,business/entrepreneurship
Innovation & Entrepreneurship - From Basics to Open Innovation,EIT Digital,course,https://www.coursera.org/learn/open-innovation-entrepreneurship,business/entrepreneurship
Innovation Strategy: Developing Your Fintech strategy,Copenhagen Business School,course,https://www.coursera.org/learn/innovation-strategy-fintech,business/entrepreneurship
"Coding for Designers, Managers, & Entrepreneurs I",University of Virginia,course,https://www.coursera.org/learn/uva-coding-for-design-managers-1,business/entrepreneurship
真格—北大在线创业课堂,Peking University,course,https://www.coursera.org/learn/zhenge-beida-zaixian-chuangye,business/entrepreneurship
L'impact investing : comprendre les fondamentaux,ESSEC Business School,course,https://www.coursera.org/learn/investing-fondamentaux,business/entrepreneurship
Changer le monde : passons a l'action (creer son entreprise sociale),ESSEC Business School,course,https://www.coursera.org/learn/monde-action,business/entrepreneurship
Wharton Entrepreneurship Capstone,University of Pennsylvania,course,https://www.coursera.org/learn/wharton-entrepreneurship-capstone,business/entrepreneurship
Beyond Silicon Valley: Growing Entrepreneurship in Transitioning Economies,Case Western Reserve University,course,https://www.coursera.org/learn/entrepreneurship-development,business/entrepreneurship
Entrepreneurship II: Preparing for Launch,University of Illinois at Urbana-Champaign,course,https://www.coursera.org/learn/entrepreneurship-2,business/entrepreneurship
Business Models for Innovative Care for Older People,University of Copenhagen,course,https://www.coursera.org/learn/business-models-innovative-care,business/entrepreneurship
The Impact of Technology,EIT Digital,course,https://www.coursera.org/learn/impact-of-technology,business/entrepreneurship
Sustainable Innovation for Subsistence Marketplaces,University of Illinois at Urbana-Champaign,course,https://www.coursera.org/learn/subsistence-marketplaces-1,business/entrepreneurship
Entrepreneurship,The Chinese University of Hong Kong,course,https://www.coursera.org/learn/entrepreneurship,business/entrepreneurship
The Search for Great Ideas: Harnessing creativity to empower innovation.,Michigan State University,course,https://www.coursera.org/learn/start-your-own-business-2-ideation,business/entrepreneurship
Les partenariats qui changent le monde : alliances innovantes entre entreprises et associations,ESSEC Business School,course,https://www.coursera.org/learn/partenariats-qui-changent-le-monde,business/entrepreneurship
Структура презентации технологических и инвестиционных проектов,Moscow Institute of Physics and Technology,course,https://www.coursera.org/learn/struktura-prezentacii-tekhnologicheskih-i-investicionnyh-proektov,business/entrepreneurship
Закон стартапа: юридические основы технологического бизнеса,Moscow Institute of Physics and Technology,course,https://www.coursera.org/learn/zakon-startapa-tekhnologicheskogo-biznesa,business/entrepreneurship
Global Health Innovations,Imperial College London,specialization,https://www.coursera.org/specializations/global-health-innovations,business/entrepreneurship
Building the Business Model for Corporate Entrepreneurs,"University of Maryland, College Park",course,https://www.coursera.org/learn/corporate-entrepreneurs-business-model,business/entrepreneurship
Entrepreneurial Strategic Management,University of New Mexico,course,https://www.coursera.org/learn/entrepreneurial-strategic-management,business/entrepreneurship
Creativity Toolkit II: Creative Collaboration,University of Illinois at Urbana-Champaign,course,https://www.coursera.org/learn/creativity-toolkit-2,business/entrepreneurship
A Guide to Healthcare Innovation: Principles and Practice,Imperial College London,course,https://www.coursera.org/learn/guide-to-healthcare-innovation-principles-and-practice,business/entrepreneurship
"Planning: Principled, Proposing, Proofing, and Practicing to a Success Plan",Michigan State University,course,https://www.coursera.org/learn/business-planning,business/entrepreneurship
¿Cómo financiar mi empresa?,Universidad de los Andes,course,https://www.coursera.org/learn/financiar-mi-empresa,business/entrepreneurship
Protecting Business Innovations via Strategy,The Hong Kong University of Science and Technology,course,https://www.coursera.org/learn/protect-business-innovations-strategy,business/entrepreneurship
Правовое регулирование налога на прибыль в Российской Федерации,Saint Petersburg State University,course,https://www.coursera.org/learn/pravovoe-regulirovanie-naloga-na-pribyl,business/entrepreneurship
"Fundamentals of Sales and Marketing, with Goldman Sachs 10,000 Women",Goldman Sachs,course,https://www.coursera.org/learn/10k-women-6,business/entrepreneurship
Building Fintech Startups in Emerging Markets,University of Cape Town,course,https://www.coursera.org/learn/building-fintech-startups,business/entrepreneurship
Social Business Model and Planning for Social Innovation,Copenhagen Business School,course,https://www.coursera.org/learn/social-business-model,business/entrepreneurship
Innovation & Entrepreneurship - From Design Thinking to Funding,EIT Digital,course,https://www.coursera.org/learn/design-thinking-entrepreneurship,business/entrepreneurship
Be entrepreneurial in Cultural Industries in the digital age,Sciences Po,course,https://www.coursera.org/learn/entrepreneurial-culture-digital-age,business/entrepreneurship
Unleashing the Impact of your Social Enterprise,Copenhagen Business School,course,https://www.coursera.org/learn/social-impact-growth,business/entrepreneurship
Developing the Opportunity for Corporate Entrepreneurs,"University of Maryland, College Park",course,https://www.coursera.org/learn/corporate-entrepreneurs-opportunity,business/entrepreneurship
"Grow Your Business with Goldman Sachs 10,000 Women",Goldman Sachs,course,https://www.coursera.org/learn/10k-women-1,business/entrepreneurship
Master Class for Corporate Entrepreneurs,"University of Maryland, College Park",course,https://www.coursera.org/learn/corporate-entrepreneurship-project,business/entrepreneurship
Structure: Building the Frame for Business Growth,Michigan State University,course,https://www.coursera.org/learn/business-structure,business/entrepreneurship
L'impact investing : être acteur,ESSEC Business School,course,https://www.coursera.org/learn/impact-investing-etre-acteur,business/entrepreneurship
Innovation Career Lessons from a Master,Technion - Israel Institute of Technology,course,https://www.coursera.org/learn/startup-entrepreneurship-innovation-career-lessons,business/entrepreneurship
"Knowledge Exchange: Using, Protecting and Monetizing Ideas with Third Parties",Universiteit Leiden,course,https://www.coursera.org/learn/knowledge-exchange,business/entrepreneurship
Crafting Strategies for Innovation Initiatives for Corporate Entrepreneurs,"University of Maryland, College Park",course,https://www.coursera.org/learn/corporate-entrepreneurs-innovation-strategy,business/entrepreneurship
How to finance your venture ?,École Polytechnique,course,https://www.coursera.org/learn/finance-venture,business/entrepreneurship
Financing and Profiting from Innovation for Corporate Entrepreneurs,"University of Maryland, College Park",course,https://www.coursera.org/learn/corporate-entrepreneurs-financing,business/entrepreneurship
Healthcare Entrepreneurship: Taking Ideas to Market,Imperial College London,course,https://www.coursera.org/learn/ghi-healthcare-entrepreneurship-taking-ideas-to-market,business/entrepreneurship
"Technology Commercialization, Part 1: Setting up your Idea Filtering System",University of Rochester,course,https://www.coursera.org/learn/technology-commercialization,business/entrepreneurship
Diseñando una estrategia de negocios en América Latina,Tecnológico de Monterrey,course,https://www.coursera.org/learn/disenando-estrategia-negocio-america-latina,business/entrepreneurship
3D Printing Capstone,University of Illinois at Urbana-Champaign,course,https://www.coursera.org/learn/3d-printing-capstone,business/entrepreneurship
L'impact investing : innover,ESSEC Business School,course,https://www.coursera.org/learn/impactinvestinginnover,business/entrepreneurship
Subsistence Marketplaces,University of Illinois at Urbana-Champaign,course,https://www.coursera.org/learn/subsistence-marketplaces,business/entrepreneurship
Entrepreneurship Capstone,"University of Maryland, College Park",course,https://www.coursera.org/learn/entrepreneurship-capstone,business/entrepreneurship
Innovation: From Creativity to Entrepreneurship Capstone,University of Illinois at Urbana-Champaign,course,https://www.coursera.org/learn/innovation-creativity-entrepreneurship-capstone,business/entrepreneurship
Launch Strategy: 5 Steps to Capstone Experience,Michigan State University,course,https://www.coursera.org/learn/launch-strategy,business/entrepreneurship
"Fundamentals of Business Finance, with Goldman Sachs 10,000 Women",Goldman Sachs,course,https://www.coursera.org/learn/10k-women-2,business/entrepreneurship
"Fundamentals of Leadership, with Goldman Sachs 10,000 Women",Goldman Sachs,course,https://www.coursera.org/learn/10k-women-3,business/entrepreneurship
Healthcare Innovation: What Does Success Look Like and How to Achieve It?,Imperial College London,course,https://www.coursera.org/learn/ghi-healthcare-innovation-what-success-look-like-how-to-achieve,business/entrepreneurship
Getting started with Augmented Reality,Institut Mines-Télécom,course,https://www.coursera.org/learn/augmented-reality,business/entrepreneurship
