title,university,form,link,category
UX (User Experience) Capstone,University of Michigan,course,https://www.coursera.org/learn/user-experience-capstone,computer-science/design-and-product
Arte 3D y animación en videojuegos,Universitat Autònoma de Barcelona,course,https://www.coursera.org/learn/videojuegos-animation,computer-science/design-and-product
CAM and Design Manufacturing for Mechanical Engineers with Autodesk Fusion 360,Autodesk,course,https://www.coursera.org/learn/cam-design-manufacturing-mechanical-engineers,computer-science/design-and-product
Developing FPGA-accelerated cloud applications with SDAccel: Practice,Politecnico di Milano,course,https://www.coursera.org/learn/fpga-sdaccel-practice,computer-science/design-and-product
Making Your First Virtual Reality Game,University of London,course,https://www.coursera.org/learn/making-virtual-reality-game,computer-science/design-and-product
Project Planning and Machine Learning,University of Colorado Boulder,course,https://www.coursera.org/learn/industrial-iot-project-planning-machine-learning,computer-science/design-and-product
Enseignes et afficheurs à LED,École Polytechnique Fédérale de Lausanne,course,https://www.coursera.org/learn/enseignes-et-afficheurs-led,computer-science/design-and-product
Secure Networked System with Firewall and IDS,University of Colorado System,course,https://www.coursera.org/learn/secure-networked-system-with-firewall-ids,computer-science/design-and-product
Diseño de Videojuegos: Una introducción,Universidad de los Andes,course,https://www.coursera.org/learn/diseno-videojuegos-intro,computer-science/design-and-product
Interaction Design Capstone Project,University of California San Diego,course,https://www.coursera.org/learn/interaction-design-capstone,computer-science/design-and-product
软件工程,Peking University,course,https://www.coursera.org/learn/ruanjian-gongcheng,computer-science/design-and-product
Modeling and Debugging Embedded Systems,University of Colorado Boulder,course,https://www.coursera.org/learn/modeling-debugging-embedded-systems,computer-science/design-and-product
Building Interactive 3D Characters and Social VR,University of London,course,https://www.coursera.org/learn/interactive-3d-characters-social-virtual-reality,computer-science/design-and-product
Generative Design for Performance and Weight Reduction,Autodesk,course,https://www.coursera.org/learn/generative-design-performance-weight-reduction,computer-science/design-and-product
UI Design Capstone,University of Minnesota,course,https://www.coursera.org/learn/ui-design-capstone,computer-science/design-and-product
Game Design Document: Define the Art & Concepts,California Institute of the Arts,course,https://www.coursera.org/learn/game-design-document,computer-science/design-and-product
Desarrollo de aplicaciones avanzadas con Android,Universidad Nacional Autónoma de México,course,https://www.coursera.org/learn/aplicaciones-android,computer-science/design-and-product
Generative Design for Industrial Applications,Autodesk,course,https://www.coursera.org/learn/generative-design-industrial-applications,computer-science/design-and-product
Desarrollo de Videojuegos 3D en Unity: Una Introducción,Universidad de los Andes,course,https://www.coursera.org/learn/juegos-3d,computer-science/design-and-product
Emprendimiento y métodos ágiles de desarrollo en videojuegos,Universidad de los Andes,course,https://www.coursera.org/learn/videojuegos-emprendimiento,computer-science/design-and-product
Integrating Scripts for Scene Interactions,Unity,course,https://www.coursera.org/learn/integrating-scripts-for-scene-interactions,computer-science/design-and-product
Creating Cutscenes in Unity,Unity,course,https://www.coursera.org/learn/creating-cutscenes-unity,computer-science/design-and-product
Generative Design for Part Consolidation,Autodesk,course,https://www.coursera.org/learn/generative-design-part-consolidation,computer-science/design-and-product
Programming for Level Design,Unity,course,https://www.coursera.org/learn/programming-level-design,computer-science/design-and-product
Performance Optimization in Unity,Unity,course,https://www.coursera.org/learn/performance-optimization-unity,computer-science/design-and-product
Esports Teams and Professional Players,"University of California, Irvine",course,https://www.coursera.org/learn/esports-teams-professional-players,computer-science/design-and-product
Motores gráficos en videojuegos: game engine,Universitat Autònoma de Barcelona,course,https://www.coursera.org/learn/videojuegos-engine,computer-science/design-and-product
Desenvolvimento e Design de Aplicativos para iPhone,Universidade Estadual de Campinas,specialization,https://www.coursera.org/specializations/desenvolvimento-aplicativos,computer-science/design-and-product
System Validation (2): Model process behaviour,EIT Digital,course,https://www.coursera.org/learn/system-validation-behavior,computer-science/design-and-product
Collegiate Esports and Career Planning,"University of California, Irvine",course,https://www.coursera.org/learn/college-esports-career-planning,computer-science/design-and-product
Gameplay en videojuegos,Universitat Autònoma de Barcelona,course,https://www.coursera.org/learn/videojuegos-play,computer-science/design-and-product
NPC Programming,Unity,course,https://www.coursera.org/learn/npc-programming,computer-science/design-and-product
游戏策划与设计,Fudan University,course,https://www.coursera.org/learn/youxi-cehua-sheji,computer-science/design-and-product
"Coding for Designers, Managers, & Entrepreneurs III",University of Virginia,course,https://www.coursera.org/learn/uva-coding-for-design-managers-3,computer-science/design-and-product
"Coding for Designers, Managers, & Entrepreneurs II",University of Virginia,course,https://www.coursera.org/learn/uva-coding-for-design-managers-2,computer-science/design-and-product
Unity Services Implementation,Unity,course,https://www.coursera.org/learn/unity-services-implementation,computer-science/design-and-product
