title,university,form,link,category
Introduction to Blockchain,Association of International Certified Professional Accountants,specialization,https://www.coursera.org/specializations/introduction-to-blockchain,computer-science/computer-security-and-networks
Security Operations and Administration,(ISC)²,course,https://www.coursera.org/learn/security-operations-administration-sscp,computer-science/computer-security-and-networks
Basic Cryptography and Programming with Crypto API,University of Colorado System,course,https://www.coursera.org/learn/basic-cryptography-and-crypto-api,computer-science/computer-security-and-networks
Segurança de TI: Defesa Contra as Artes Obscuras do Mundo Digital,Cresça com o Google,course,https://www.coursera.org/learn/seguranca-de-it,computer-science/computer-security-and-networks
Administração de Sistemas e Serviços de Infraestrutura de TI,Cresça com o Google,course,https://www.coursera.org/learn/administracao-de-sistemas-servicos-infraestrutura-ti,computer-science/computer-security-and-networks
Teaching Impacts of Technology: Fundamentals,University of California San Diego,course,https://www.coursera.org/learn/teach-impacts-technology-fundamentals,computer-science/computer-security-and-networks
Getting Started with Google Kubernetes Engine en Español,Google Cloud,course,https://www.coursera.org/learn/google-kubernetes-engine-es,computer-science/computer-security-and-networks
"Planning, Auditing and Maintaining Enterprise Systems",University of Colorado System,course,https://www.coursera.org/learn/planning-auditing-maintaining-enterprise-systems,computer-science/computer-security-and-networks
Security and Privacy in TOR Network,University of Colorado System,course,https://www.coursera.org/learn/security-and-privacy-in-tor-network,computer-science/computer-security-and-networks
Asymmetric Cryptography and Key Management,University of Colorado System,course,https://www.coursera.org/learn/asymmetric-crypto,computer-science/computer-security-and-networks
Cloud Computing Project,University of Illinois at Urbana-Champaign,course,https://www.coursera.org/learn/cloud-computing-project,computer-science/computer-security-and-networks
Elastic Cloud Infrastructure: Containers and Services 日本語版,Google Cloud,course,https://www.coursera.org/learn/gcp-infrastructure-containers-services-jp,computer-science/computer-security-and-networks
DDoS Attacks and Defenses,University of Colorado System,course,https://www.coursera.org/learn/ddos-attacks-and-defense,computer-science/computer-security-and-networks
Cybersecurity Policy for Aviation and Internet Infrastructures,University of Colorado System,course,https://www.coursera.org/learn/cybersecurity-policy-aviation-internet,computer-science/computer-security-and-networks
Palo Alto Networks Cybersecurity Essentials II,Palo Alto Networks,course,https://www.coursera.org/learn/cybersecurity-essentials-2,computer-science/computer-security-and-networks
Networks and Communications Security,(ISC)²,course,https://www.coursera.org/learn/network-security-communications-sscp,computer-science/computer-security-and-networks
Secure Networked System with Firewall and IDS,University of Colorado System,course,https://www.coursera.org/learn/secure-networked-system-with-firewall-ids,computer-science/computer-security-and-networks
Cryptography: Boolean functions and related problems,Novosibirsk State University,course,https://www.coursera.org/learn/cryptography-boolean-functions,computer-science/computer-security-and-networks
Systems and Application Security,(ISC)²,course,https://www.coursera.org/learn/systems-application-security-sscp,computer-science/computer-security-and-networks
Architecting with Google Kubernetes Engine en Portuguese,Google Cloud,specialization,https://www.coursera.org/specializations/architecting-google-kubernetes-engine-br,computer-science/computer-security-and-networks
Cybersecurity Policy for Water and Electricity Infrastructures,University of Colorado System,course,https://www.coursera.org/learn/cybersecurity-policy-water-electricity,computer-science/computer-security-and-networks
Data Engineering on Google Cloud Platform em Português Brasileiro,Google Cloud,specialization,https://www.coursera.org/specializations/gcp-data-machine-learning-br,computer-science/computer-security-and-networks
Google Cloud Platform Fundamentals: Core Infrastructure em Português Brasileiro,Google Cloud,course,https://www.coursera.org/learn/gcp-fundamentals-br,computer-science/computer-security-and-networks
Data Engineering on Google Cloud Platform en Français,Google Cloud,specialization,https://www.coursera.org/specializations/gcp-data-machine-learning-fr,computer-science/computer-security-and-networks
Essential Cloud Infrastructure: Foundation en Español,Google Cloud,course,https://www.coursera.org/learn/gcp-infrastructure-foundation-es,computer-science/computer-security-and-networks
Blockchain Para a Empresa,INSEAD,specialization,https://www.coursera.org/specializations/blockchain-para-a-empresa,computer-science/computer-security-and-networks
Data Engineering on Google Cloud Platform 日本語版,Google Cloud,specialization,https://www.coursera.org/specializations/gcp-data-machine-learning-jp,computer-science/computer-security-and-networks
Networking and Security in iOS Applications,"University of California, Irvine",course,https://www.coursera.org/learn/security,computer-science/computer-security-and-networks
Palo Alto Networks Cybersecurity Gateway II,Palo Alto Networks,course,https://www.coursera.org/learn/cybersecurity-gateway-2,computer-science/computer-security-and-networks
Homeland Security and Cybersecurity Future,University of Colorado System,course,https://www.coursera.org/learn/homeland-security-cybersecurity-future,computer-science/computer-security-and-networks
Cryptographic Hash and Integrity Protection,University of Colorado System,course,https://www.coursera.org/learn/cryptographic-hash-integrity-protection,computer-science/computer-security-and-networks
Cybersecurity Capstone Project,"University of Maryland, College Park",course,https://www.coursera.org/learn/cyber-security-capstone,computer-science/computer-security-and-networks
"Blockchain, Cryptoassets, and Decentralized Finance",INSEAD,course,https://www.coursera.org/learn/blockchain-crypto-decentralized-finance,computer-science/computer-security-and-networks
Google Cloud Fundamentals for Azure Professionals: Core Infrastructure,Google Cloud,course,https://www.coursera.org/learn/gcp-fundamentals-azure,computer-science/computer-security-and-networks
Blockchain Transformations of Financial Services,INSEAD,course,https://www.coursera.org/learn/blockchain-transformations-financial-services,computer-science/computer-security-and-networks
Google Cloud Platform Fundamentals: Core Infrastructure en Français,Google Cloud,course,https://www.coursera.org/learn/gcp-fundamentals-fr,computer-science/computer-security-and-networks
Introdução às Tecnologias Blockchain,INSEAD,course,https://www.coursera.org/learn/introducao-tecnologias-blockchain,computer-science/computer-security-and-networks
"Teaching Impacts of Technology: Data Collection, Use, and Privacy",University of California San Diego,course,https://www.coursera.org/learn/teach-impacts-technology-data,computer-science/computer-security-and-networks
Blockchain in Financial Services: Strategic Action Plan,INSEAD,course,https://www.coursera.org/learn/blockchain-strategic-action-plan,computer-science/computer-security-and-networks
Google Cloud Platform Fundamentals: Core Infrastructure dalam bahasa Indonesia,Google Cloud,course,https://www.coursera.org/learn/gcp-fundamentals-core-infrastructure-id,computer-science/computer-security-and-networks
Elastic Cloud Infrastructure: Containers and Services en Español,Google Cloud,course,https://www.coursera.org/learn/gcp-infrastructure-containers-services-es,computer-science/computer-security-and-networks
Elastic Cloud Infrastructure: Scaling and Automation en Español,Google Cloud,course,https://www.coursera.org/learn/gcp-infrastructure-scaling-automation-es,computer-science/computer-security-and-networks
Essential Cloud Infrastructure: Core Services en Español,Google Cloud,course,https://www.coursera.org/learn/gcp-infrastructure-core-services-es,computer-science/computer-security-and-networks
Reliable Cloud Infrastructure: Design and Process 日本語版,Google Cloud,course,https://www.coursera.org/learn/cloud-infrastructure-design-process-jp,computer-science/computer-security-and-networks
Serverless Data Analysis with Google BigQuery and Cloud Dataflow en Español,Google Cloud,course,https://www.coursera.org/learn/serverless-data-analysis-bigquery-cloud-dataflow-gcp-es,computer-science/computer-security-and-networks
Teaching Impacts of Technology: Workplace of the Future,University of California San Diego,course,https://www.coursera.org/learn/teach-impacts-technology-workplace-future,computer-science/computer-security-and-networks
Advanced System Security Topics,University of Colorado System,course,https://www.coursera.org/learn/advanced-system-security-topics,computer-science/computer-security-and-networks
Architecting with Google Cloud Platform auf Deutsch,Google Cloud,specialization,https://www.coursera.org/specializations/gcp-architecture-de,computer-science/computer-security-and-networks
"System Validation (4): Modelling Software, Protocols, and other behaviour",EIT Digital,course,https://www.coursera.org/learn/system-validation-software-protocols,computer-science/computer-security-and-networks
操作系统与虚拟化安全,Peking University,course,https://www.coursera.org/learn/os-virtsecurity,computer-science/computer-security-and-networks
G Suite Administration 日本語版,Google Cloud,specialization,https://www.coursera.org/specializations/g-suite-administration-jp,computer-science/computer-security-and-networks
Google Cloud Platform Fundamentals: Core Infrastructure auf Deutsch,Google Cloud,course,https://www.coursera.org/learn/gcp-fundamentals-de,computer-science/computer-security-and-networks
Reliable Cloud Infrastructure: Design and Process en Español,Google Cloud,course,https://www.coursera.org/learn/cloud-infrastructure-design-process-es,computer-science/computer-security-and-networks
Teaching Impacts of Technology: Relationships,University of California San Diego,course,https://www.coursera.org/learn/teach-impacts-technology-relationships,computer-science/computer-security-and-networks
Introduction to G Suite 日本語版,Google Cloud,course,https://www.coursera.org/learn/introduction-g-suite-jp,computer-science/computer-security-and-networks
Elastic Cloud Infrastructure: Containers and Services dalam bahasa Indonesia,Google Cloud,course,https://www.coursera.org/learn/gcp-infrastructure-containers-services-id,computer-science/computer-security-and-networks
Essential Cloud Infrastructure: Core Services em Português Brasileiro,Google Cloud,course,https://www.coursera.org/learn/gcp-infrastructure-core-services-br,computer-science/computer-security-and-networks
Serverless Data Analysis with Google BigQuery and Cloud Dataflow 日本語版,Google Cloud,course,https://www.coursera.org/learn/serverless-data-analysis-bigquery-cloud-dataflow-gcp-jp,computer-science/computer-security-and-networks
The Business of Cybersecurity Capstone,University System of Georgia,course,https://www.coursera.org/learn/business-of-cybersecurity-capstone,computer-science/computer-security-and-networks
Getting Started with Google Kubernetes Engine 日本語版,Google Cloud,course,https://www.coursera.org/learn/google-kubernetes-engine-jp,computer-science/computer-security-and-networks
Essential Cloud Infrastructure: Foundation dalam bahasa Indonesia,Google Cloud,course,https://www.coursera.org/learn/essential-cloud-infrastructure-foundation-id,computer-science/computer-security-and-networks
Essential Cloud Infrastructure: Foundation em Português Brasileiro,Google Cloud,course,https://www.coursera.org/learn/gcp-infrastructure-foundation-br,computer-science/computer-security-and-networks
Essential Cloud Infrastructure: Core Services dalam bahasa Indonesia,Google Cloud,course,https://www.coursera.org/learn/essential-cloud-infrastructure-core-services-id,computer-science/computer-security-and-networks
Essential Cloud Infrastructure: Foundation en Français,Google Cloud,course,https://www.coursera.org/learn/gcp-infrastructure-foundation-fr,computer-science/computer-security-and-networks
Data Engineering on Google Cloud Platform auf Deutsch,Google Cloud,specialization,https://www.coursera.org/specializations/gcp-data-machine-learning-de,computer-science/computer-security-and-networks
G Suite Security 日本語版,Google Cloud,course,https://www.coursera.org/learn/g-suite-security-jp,computer-science/computer-security-and-networks
Architecting with Google Kubernetes Engine: Workloads 日本語版,Google Cloud,course,https://www.coursera.org/learn/deploying-workloads-google-kubernetes-engine-gke-jp,computer-science/computer-security-and-networks
Serverless Data Analysis with Google BigQuery and Cloud Dataflow en Français,Google Cloud,course,https://www.coursera.org/learn/serverless-data-analysis-bigquery-cloud-dataflow-gcp-fr,computer-science/computer-security-and-networks
G Suite Mail Management 日本語版,Google Cloud,course,https://www.coursera.org/learn/g-suite-mail-management-jp,computer-science/computer-security-and-networks
Teaching Impacts of Technology: Global Society,University of California San Diego,course,https://www.coursera.org/learn/teach-impacts-technology-global-society,computer-science/computer-security-and-networks
Architecting with Google Kubernetes Engine: Workloads en Español,Google Cloud,course,https://www.coursera.org/learn/deploying-workloads-google-kubernetes-engine-gke-es,computer-science/computer-security-and-networks
Elastic Cloud Infrastructure: Scaling and Automation dalam bahasa Indonesia,Google Cloud,course,https://www.coursera.org/learn/elastic-cloud-infrastructure-scaling-automation-id,computer-science/computer-security-and-networks
Managing G Suite 日本語版,Google Cloud,course,https://www.coursera.org/learn/managing-g-suite-jp,computer-science/computer-security-and-networks
Elastic Cloud Infrastructure: Scaling and Automation em Português Brasileiro,Google Cloud,course,https://www.coursera.org/learn/gcp-infrastructure-scaling-automation-br,computer-science/computer-security-and-networks
Serverless Data Analysis with Google BigQuery and Cloud Dataflow em Português Brasileiro,Google Cloud,course,https://www.coursera.org/learn/serverless-data-analysis-bigquery-cloud-dataflow-gcp-br,computer-science/computer-security-and-networks
Reliable Cloud Infrastructure: Design and Process dalam bahasa Indonesia,Google Cloud,course,https://www.coursera.org/learn/cloud-infrastructure-design-process-id,computer-science/computer-security-and-networks
Architecting with Google Kubernetes Engine: Production en Español,Google Cloud,course,https://www.coursera.org/learn/deploying-secure-kubernetes-containers-in-production-es,computer-science/computer-security-and-networks
Reliable Cloud Infrastructure: Design and Process em Português Brasileiro,Google Cloud,course,https://www.coursera.org/learn/cloud-infrastructure-design-process-br,computer-science/computer-security-and-networks
Elastic Cloud Infrastructure: Containers and Services en Français,Google Cloud,course,https://www.coursera.org/learn/gcp-infrastructure-containers-services-fr,computer-science/computer-security-and-networks
Elastic Cloud Infrastructure: Containers and Services em Português Brasileiro,Google Cloud,course,https://www.coursera.org/learn/gcp-infrastructure-containers-services-br,computer-science/computer-security-and-networks
Architecting with Google Kubernetes Engine: Production 日本語版,Google Cloud,course,https://www.coursera.org/learn/deploying-secure-kubernetes-containers-in-production-jp,computer-science/computer-security-and-networks
Architecting with Google Kubernetes Engine: Workloads em Português Brasileiro,Google Cloud,course,https://www.coursera.org/learn/deploying-workloads-google-kubernetes-engine-gke-br,computer-science/computer-security-and-networks
Elastic Cloud Infrastructure: Scaling and Automation en Français,Google Cloud,course,https://www.coursera.org/learn/gcp-infrastructure-scaling-automation-fr,computer-science/computer-security-and-networks
Essential Cloud Infrastructure: Foundation auf Deutsch,Google Cloud,course,https://www.coursera.org/learn/gcp-infrastructure-foundation-de,computer-science/computer-security-and-networks
Reliable Cloud Infrastructure: Design and Process auf Deutsch,Google Cloud,course,https://www.coursera.org/learn/cloud-infrastructure-design-process-de,computer-science/computer-security-and-networks
Essential Cloud Infrastructure: Core Services auf Deutsch,Google Cloud,course,https://www.coursera.org/learn/gcp-infrastructure-core-services-de,computer-science/computer-security-and-networks
Serverless Data Analysis with Google BigQuery and Cloud Dataflow auf Deutsch,Google Cloud,course,https://www.coursera.org/learn/serverless-data-analysis-bigquery-cloud-dataflow-gcp-de,computer-science/computer-security-and-networks
Elastic Cloud Infrastructure: Containers and Services auf Deutsch,Google Cloud,course,https://www.coursera.org/learn/gcp-infrastructure-containers-services-de,computer-science/computer-security-and-networks
