title,university,form,link,category
Vital Signs: Understanding What the Body Is Telling Us,University of Pennsylvania,course,https://www.coursera.org/learn/vital-signs,life-sciences/patient-care
Farmacología para odontólogos,Universidad Nacional Autónoma de México,course,https://www.coursera.org/learn/farmaco-odontologos,life-sciences/patient-care
COVID-19: What You Need to Know (CME Eligible),Osmosis,course,https://www.coursera.org/learn/covid-19-what-you-need-to-know,life-sciences/patient-care
Cuidado de heridas en el ámbito hospitalario,Universidad Nacional Autónoma de México,course,https://www.coursera.org/learn/cuidado-heridas,life-sciences/patient-care
Atención Primaria en Salud: El desafío de las Enfermedades no Transmisibles,Pontificia Universidad Católica de Chile,course,https://www.coursera.org/learn/enfermedades-no-transmisibles,life-sciences/patient-care
Autism Spectrum Disorder,"University of California, Davis",course,https://www.coursera.org/learn/autism-spectrum-disorder,life-sciences/patient-care
Clinical Terminology for International and U.S. Students,University of Pittsburgh,course,https://www.coursera.org/learn/clinical-terminology,life-sciences/patient-care
Inclusión social de personas con discapacidad desde un enfoque de derechos.,Universidad de Chile,course,https://www.coursera.org/learn/inclusion-social-personas-discapacidad,life-sciences/patient-care
Diálisis peritoneal,Universidad Nacional Autónoma de México,course,https://www.coursera.org/learn/dialisis-peritoneal,life-sciences/patient-care
Addiction Treatment: Clinical Skills for Healthcare Providers,Yale University,course,https://www.coursera.org/learn/addiction-treatment,life-sciences/patient-care
Become an EMT,University of Colorado System,specialization,https://www.coursera.org/specializations/become-an-emt,life-sciences/patient-care
Stanford's Short Course on Breastfeeding,Stanford University,course,https://www.coursera.org/learn/breastfeeding,life-sciences/patient-care
Integrative Health and Medicine,University of Minnesota,specialization,https://www.coursera.org/specializations/integrative-health-and-medicine,life-sciences/patient-care
Spanish for Successful Communication in Healthcare Settings,Rice University,course,https://www.coursera.org/learn/spanish-in-healthcare-settings,life-sciences/patient-care
Manejo moderno de la caries dental,Universidad Nacional Autónoma de México,course,https://www.coursera.org/learn/tratamiento-caries,life-sciences/patient-care
Bacteria and Chronic Infections,University of Copenhagen,course,https://www.coursera.org/learn/bacterial-infections,life-sciences/patient-care
Troubles du spectre de l'autisme : diagnostic,University of Geneva,course,https://www.coursera.org/learn/troubles-spectre-autisme-diagnostic,life-sciences/patient-care
Dermatology: Trip to skin,Novosibirsk State University,course,https://www.coursera.org/learn/dermatology,life-sciences/patient-care
Managing Your Health: The Role of Physical Therapy and Exercise,University of Toronto,course,https://www.coursera.org/learn/physical-therapy-exercise,life-sciences/patient-care
Evaluación del Aprendizaje en Escenarios Clínicos,Tecnológico de Monterrey,course,https://www.coursera.org/learn/evaluacion-aprendizaje-escenarios-clinicos,life-sciences/patient-care
EMT Foundations,University of Colorado System,course,https://www.coursera.org/learn/emt-foundations,life-sciences/patient-care
Patient Safety,Johns Hopkins University,specialization,https://www.coursera.org/specializations/patient-safety,life-sciences/patient-care
School Health for Children and Adolescents,University of Colorado System,specialization,https://www.coursera.org/specializations/school-health-for-children-and-adolescents,life-sciences/patient-care
"Medical Emergencies: Airway, Breathing, and Circulation",University of Colorado System,course,https://www.coursera.org/learn/medical-emergencies-airway-breathing-circulation,life-sciences/patient-care
Essentials in Clinical Simulations Across the Health Professions,The George Washington University,course,https://www.coursera.org/learn/clinicalsimulations,life-sciences/patient-care
Herbal Medicine,University of Minnesota,course,https://www.coursera.org/learn/herbalmedicine,life-sciences/patient-care
Farmacovigilancia ocular,Universidad Nacional Autónoma de México,course,https://www.coursera.org/learn/farmacovigilancia-ocular,life-sciences/patient-care
Health Concepts in Chinese Medicine,The Hong Kong University of Science and Technology,course,https://www.coursera.org/learn/health-concepts-chinese-medicine,life-sciences/patient-care
Dentistry 101,University of Michigan,course,https://www.coursera.org/learn/dentistry101,life-sciences/patient-care
Preventing Chronic Pain: A Human Systems Approach,University of Minnesota,course,https://www.coursera.org/learn/chronic-pain,life-sciences/patient-care
Newborn Baby Care,University of Colorado System,specialization,https://www.coursera.org/specializations/newborn-baby-care,life-sciences/patient-care
Case Studies in Personalized Medicine,Vanderbilt University,course,https://www.coursera.org/learn/personalizedmed,life-sciences/patient-care
Myocardial Infarction,University of Zurich,course,https://www.coursera.org/learn/infarction,life-sciences/patient-care
Medical Cannabis for Pain Control,Technion - Israel Institute of Technology,course,https://www.coursera.org/learn/medical-cannabis-pain-control,life-sciences/patient-care
Career 911: Your Future Job in Medicine and Healthcare,Northwestern University,course,https://www.coursera.org/learn/healthcarejobs,life-sciences/patient-care
Actúa ante el dolor crónico,Universitat Autònoma de Barcelona,course,https://www.coursera.org/learn/actua-dolor-cronico,life-sciences/patient-care
Introduction to Integrative Therapies and Healing Practices,University of Minnesota,course,https://www.coursera.org/learn/integrative-therapies-and-healing-practices,life-sciences/patient-care
"Managing ADHD, Autism, Learning Disabilities, and Concussion in School",University of Colorado System,course,https://www.coursera.org/learn/managing-adhd-autism-learning-disabilities-and-concussion-in-school,life-sciences/patient-care
"Medical Emergencies: CPR, Toxicology, and Wilderness",University of Colorado System,course,https://www.coursera.org/learn/medical-emergencies-cpr-toxicology-wilderness,life-sciences/patient-care
"Clinical Kidney, Pancreas and Islet Transplantation",Universiteit Leiden,course,https://www.coursera.org/learn/clinical-kidney-transplantation,life-sciences/patient-care
Preventative Healthcare for the Newborn Baby,University of Colorado System,course,https://www.coursera.org/learn/preventive-healthcare-newborn-baby,life-sciences/patient-care
Trauma Emergencies and Care,University of Colorado System,course,https://www.coursera.org/learn/trauma-emergencies-and-care,life-sciences/patient-care
The Basics of Trauma Surgery,Technische Universität München (TUM),course,https://www.coursera.org/learn/trauma-surgery-basics,life-sciences/patient-care
Acute and Chronic Rhinosinusitis: A Comprehensive Review,Icahn School of Medicine at Mount Sinai,course,https://www.coursera.org/learn/icahn-school-of-medicine-at-mount-sinai-acute-and-chronic-rhinosinusitis,life-sciences/patient-care
Introduction to Cataract Surgery,University of Michigan,course,https://www.coursera.org/learn/cataract-surgery,life-sciences/patient-care
Michigan Sport-Related Concussion Training Certification,University of Michigan,course,https://www.coursera.org/learn/michigan-sport-related-concussion-training-certification,life-sciences/patient-care
"Living with Dementia: Impact on Individuals, Caregivers, Communities and Societies",Johns Hopkins University,course,https://www.coursera.org/learn/dementia-care,life-sciences/patient-care
Diagnóstico y tratamiento del dolor neuropático en atención primaria,Universidad de los Andes,course,https://www.coursera.org/learn/dolor-neuropatico-anestesiologia,life-sciences/patient-care
Palliative Care: It's Not Just Hospice Anymore,University of Colorado System,specialization,https://www.coursera.org/specializations/palliative-care,life-sciences/patient-care
Understanding Prostate Cancer,Johns Hopkins University,course,https://www.coursera.org/learn/prostate-cancer,life-sciences/patient-care
Anticoncepción hormonal al alcance de todos,Universitat Autònoma de Barcelona,course,https://www.coursera.org/learn/anticonconcepcion-hormonal,life-sciences/patient-care
"Emergency Care: Pregnancy, Infants, and Children",University of Colorado System,course,https://www.coursera.org/learn/emergency-care-pregnancy-infants-children,life-sciences/patient-care
Репродуктивное здоровье женщины и безопасная беременность,National Research Tomsk State University,course,https://www.coursera.org/learn/reproduktivnoe-zdorove-zhenshchiny,life-sciences/patient-care
Voice Disorders: What Patients and Professionals Need to Know,Icahn School of Medicine at Mount Sinai,course,https://www.coursera.org/learn/voice-disorders,life-sciences/patient-care
Cáncer de próstata,Universidad Nacional Autónoma de México,course,https://www.coursera.org/learn/cancer-prostata,life-sciences/patient-care
Teaching and Assessing Clinical Skills,University of Michigan,course,https://www.coursera.org/learn/clinical-skills,life-sciences/patient-care
"Managing Asthma, Allergies, Diabetes, and Seizures in School",University of Colorado System,course,https://www.coursera.org/learn/managing-asthma-allergies-diabetes-and-seizures-in-school,life-sciences/patient-care
Traditional herbal medicine in supportive cancer care: From alternative to integrative,Technion - Israel Institute of Technology,course,https://www.coursera.org/learn/cancer-medicine-alternative-herbal-asia,life-sciences/patient-care
Health for All Through Primary Health Care,Johns Hopkins University,course,https://www.coursera.org/learn/health-for-all,life-sciences/patient-care
Atención prehospitalaria del ictus agudo y selección de pacientes para tratamiento endovascular con la escala RACE,Universitat de Barcelona,course,https://www.coursera.org/learn/ictus-agudo-escala-race,life-sciences/patient-care
Introduction to Hearing Loss,Icahn School of Medicine at Mount Sinai,course,https://www.coursera.org/learn/hearing-loss,life-sciences/patient-care
Prepare for the EMT Certification Test,University of Colorado System,course,https://www.coursera.org/learn/prepare-emt-certification-test,life-sciences/patient-care
What is Palliative Care?,University of Colorado System,course,https://www.coursera.org/learn/what-is-palliative-care,life-sciences/patient-care
"Impacting the Opioid Crisis: Prevention, Education, and Practice for Non-Prescribing Providers",University of Michigan,course,https://www.coursera.org/learn/opioid,life-sciences/patient-care
COVID-19 - A clinical update,University of Florida,course,https://www.coursera.org/learn/covid19clinicalupdate,life-sciences/patient-care
Foundations for Assisting in Home Care,The State University of New York,course,https://www.coursera.org/learn/home-care,life-sciences/patient-care
AIDS: Fear and Hope,University of Michigan,course,https://www.coursera.org/learn/aids-fear-hope,life-sciences/patient-care
Designing for Sustainment: Keeping Improvement Work on Track (Patient Safety IV),Johns Hopkins University,course,https://www.coursera.org/learn/patient-safety-sustainment,life-sciences/patient-care
Supporting Parents of a Newborn Baby,University of Colorado System,course,https://www.coursera.org/learn/supporting-parents-newborn-baby,life-sciences/patient-care
Grundlagen der Unfallchirurgie,Technische Universität München (TUM),course,https://www.coursera.org/learn/unfallchirurgie,life-sciences/patient-care
Pain Management: Easing Pain in Palliative Care,University of Colorado System,course,https://www.coursera.org/learn/pain-management-easing-pain-in-palliative-care,life-sciences/patient-care
Ebola: Essential Knowledge for Health Professionals,University of Amsterdam,course,https://www.coursera.org/learn/ebola-essentials-for-health-professionals,life-sciences/patient-care
PrEParing: PrEP for Providers and Patients,Johns Hopkins University,course,https://www.coursera.org/learn/prep,life-sciences/patient-care
杏林探宝——认知中药,Shanghai Jiao Tong University,course,https://www.coursera.org/learn/zhong-yao-zhi-shi,life-sciences/patient-care
口腔种植学 （Implant Dentistry）,The University of Hong Kong,course,https://www.coursera.org/learn/implant-dentistry-chinese,life-sciences/patient-care
Taking Safety and Quality Improvement Work to the Next Level (Patient Safety VII),Johns Hopkins University,course,https://www.coursera.org/learn/patient-safety-capstone,life-sciences/patient-care
Transgender Medicine for General Medical Providers,Icahn School of Medicine at Mount Sinai,course,https://www.coursera.org/learn/transgender-medicine,life-sciences/patient-care
"Dopage : Sports, Organisations et Sciences",University of Lausanne,course,https://www.coursera.org/learn/dopage,life-sciences/patient-care
Psychosocial and Spiritual Aspects of Palliative Care,University of Colorado System,course,https://www.coursera.org/learn/psychosocial-spiritual-aspects-palliative-care,life-sciences/patient-care
Prehospital care of acute stroke and patient selection for endovascular treatment using the RACE scale,Universitat de Barcelona,course,https://www.coursera.org/learn/acute-stroke-race-scale,life-sciences/patient-care
Supervision du raisonnement clinique,University of Geneva,course,https://www.coursera.org/learn/supervision-raisonnement-clinique,life-sciences/patient-care
一堂課讓你認識肺癌（Basic Concepts of Lung Cancer: Diagnosis and Treatment）,National Taiwan University,course,https://www.coursera.org/learn/lung-cancer,life-sciences/patient-care
Palliative Care Capstone Projects,University of Colorado System,course,https://www.coursera.org/learn/palliative-care-capstone-project,life-sciences/patient-care
Service Transformed: Lessons in U.S. Veteran Centered Care,University of Michigan,course,https://www.coursera.org/learn/va-health-care,life-sciences/patient-care
Easing Physical Symptoms: It's Not Just Hospice Anymore,University of Colorado System,course,https://www.coursera.org/learn/easing-physical-symptoms,life-sciences/patient-care
Population Health: Panel Management Next Level,Universiteit Leiden,course,https://www.coursera.org/learn/panel-management,life-sciences/patient-care
İnfertilite Hemşireliği (Infertility Nursing),Koç University,course,https://www.coursera.org/learn/infertilite,life-sciences/patient-care
常见慢性病的健康管理,Shanghai Jiao Tong University,course,https://www.coursera.org/learn/chang-jian-man-xing-bing,life-sciences/patient-care
ÉCHELLE RACE: Dépistage préhospitalier de l’AVC impliquant une occlusion de gros vaisseaux cérébraux,Universitat de Barcelona,course,https://www.coursera.org/learn/prestorace-fr,life-sciences/patient-care
更年期综合管理,Peking University,course,https://www.coursera.org/learn/geng-nian-qi,life-sciences/patient-care
