title,university,form,link,category
The Data Scientist’s Toolbox,Johns Hopkins University,course,https://www.coursera.org/learn/data-scientists-tools,math-and-logic/math-and-logic
Mathematics for Machine Learning,Imperial College London,specialization,https://www.coursera.org/specializations/mathematics-machine-learning,math-and-logic/math-and-logic
Game Theory,Stanford University,course,https://www.coursera.org/learn/game-theory-1,math-and-logic/math-and-logic
Álgebra Básica,Universidad Nacional Autónoma de México,course,https://www.coursera.org/learn/algebra-basica,math-and-logic/math-and-logic
SQL for Data Science,"University of California, Davis",course,https://www.coursera.org/learn/sql-for-data-science,math-and-logic/math-and-logic
Mathematics for Machine Learning: Linear Algebra,Imperial College London,course,https://www.coursera.org/learn/linear-algebra-machine-learning,math-and-logic/math-and-logic
Introduction to Mathematical Thinking,Stanford University,course,https://www.coursera.org/learn/mathematical-thinking,math-and-logic/math-and-logic
Data Science Math Skills,Duke University,course,https://www.coursera.org/learn/datasciencemathskills,math-and-logic/math-and-logic
Introduction to Calculus,The University of Sydney,course,https://www.coursera.org/learn/introduction-to-calculus,math-and-logic/math-and-logic
Calculus: Single Variable Part 1 - Functions,University of Pennsylvania,course,https://www.coursera.org/learn/single-variable-calculus,math-and-logic/math-and-logic
Cryptography I,Stanford University,course,https://www.coursera.org/learn/crypto,math-and-logic/math-and-logic
Estadística y probabilidad,Universidad Nacional Autónoma de México,course,https://www.coursera.org/learn/estadistica-probabilidad,math-and-logic/math-and-logic
Introduction to Logic,Stanford University,course,https://www.coursera.org/learn/logic-introduction,math-and-logic/math-and-logic
"Divide and Conquer, Sorting and Searching, and Randomized Algorithms",Stanford University,course,https://www.coursera.org/learn/algorithms-divide-conquer,math-and-logic/math-and-logic
How Things Work: An Introduction to Physics,University of Virginia,course,https://www.coursera.org/learn/how-things-work,math-and-logic/math-and-logic
Introduction to Discrete Mathematics for Computer Science,National Research University Higher School of Economics,specialization,https://www.coursera.org/specializations/discrete-mathematics,math-and-logic/math-and-logic
Bayesian Statistics: From Concept to Data Analysis,"University of California, Santa Cruz",course,https://www.coursera.org/learn/bayesian-statistics,math-and-logic/math-and-logic
Probability and Statistics: To p or not to p?,University of London,course,https://www.coursera.org/learn/probability-statistics,math-and-logic/math-and-logic
Mathematics for Machine Learning: Multivariate Calculus,Imperial College London,course,https://www.coursera.org/learn/multivariate-calculus-machine-learning,math-and-logic/math-and-logic
Econometrics: Methods and Applications,Erasmus University Rotterdam,course,https://www.coursera.org/learn/erasmus-econometrics,math-and-logic/math-and-logic
Machine Design Part I,Georgia Institute of Technology,course,https://www.coursera.org/learn/machine-design1,math-and-logic/math-and-logic
Mathematics for Data Science,National Research University Higher School of Economics,specialization,https://www.coursera.org/specializations/mathematics-for-data-science,math-and-logic/math-and-logic
Mathematical Thinking in Computer Science,University of California San Diego,course,https://www.coursera.org/learn/what-is-a-proof,math-and-logic/math-and-logic
Robotics: Aerial Robotics,University of Pennsylvania,course,https://www.coursera.org/learn/robotics-flight,math-and-logic/math-and-logic
Cálculo Diferencial e Integral unidos por el Teorema Fundamental del Cálculo,Tecnológico de Monterrey,course,https://www.coursera.org/learn/calculo-diferencial,math-and-logic/math-and-logic
Pre-Calculus,Universitat Autònoma de Barcelona,course,https://www.coursera.org/learn/introduccion-al-calculo,math-and-logic/math-and-logic
Practical Time Series Analysis,The State University of New York,course,https://www.coursera.org/learn/practical-time-series-analysis,math-and-logic/math-and-logic
Matrix Algebra for Engineers,The Hong Kong University of Science and Technology,course,https://www.coursera.org/learn/matrix-algebra-engineers,math-and-logic/math-and-logic
Эконометрика (Econometrics),National Research University Higher School of Economics,course,https://www.coursera.org/learn/ekonometrika,math-and-logic/math-and-logic
Discrete Optimization,The University of Melbourne,course,https://www.coursera.org/learn/discrete-optimization,math-and-logic/math-and-logic
1.- El Cálculo - Modelo Lineal,Tecnológico de Monterrey,course,https://www.coursera.org/learn/calculo-1,math-and-logic/math-and-logic
Differential Equations for Engineers,The Hong Kong University of Science and Technology,course,https://www.coursera.org/learn/differential-equations-engineers,math-and-logic/math-and-logic
Теория игр (Game Theory),National Research University Higher School of Economics,course,https://www.coursera.org/learn/game-theory,math-and-logic/math-and-logic
Fitting Statistical Models to Data with Python,University of Michigan,course,https://www.coursera.org/learn/fitting-statistical-models-data-python,math-and-logic/math-and-logic
Introduction to Ordinary Differential Equations,Korea Advanced Institute of Science and Technology(KAIST),course,https://www.coursera.org/learn/ordinary-differential-equations,math-and-logic/math-and-logic
Комбинаторика для начинающих,Moscow Institute of Physics and Technology,course,https://www.coursera.org/learn/kombinatorika-dlya-nachinayushchikh,math-and-logic/math-and-logic
Линейная алгебра (Linear Algebra),National Research University Higher School of Economics,course,https://www.coursera.org/learn/algebra-lineynaya,math-and-logic/math-and-logic
Stochastic processes,National Research University Higher School of Economics,course,https://www.coursera.org/learn/stochasticprocesses,math-and-logic/math-and-logic
Introduction to numerical analysis,National Research University Higher School of Economics,course,https://www.coursera.org/learn/intro-to-numerical-analysis,math-and-logic/math-and-logic
Mathematics for Machine Learning: PCA,Imperial College London,course,https://www.coursera.org/learn/pca-machine-learning,math-and-logic/math-and-logic
Image and Video Processing: From Mars to Hollywood with a Stop at the Hospital,Duke University,course,https://www.coursera.org/learn/image-processing,math-and-logic/math-and-logic
"Física: Vectores, Trabajo y Energía",Tecnológico de Monterrey,course,https://www.coursera.org/learn/fisica-vectores-trabajo-energia,math-and-logic/math-and-logic
Introduction to Complex Analysis,Wesleyan University,course,https://www.coursera.org/learn/complex-analysis,math-and-logic/math-and-logic
"Graph Search, Shortest Paths, and Data Structures",Stanford University,course,https://www.coursera.org/learn/algorithms-graphs-data-structures,math-and-logic/math-and-logic
Calculus and Optimization for Machine Learning,National Research University Higher School of Economics,course,https://www.coursera.org/learn/calculus-and-optimization-for-machine-learning,math-and-logic/math-and-logic
Contenido de las matemáticas de primaria,Universidad de los Andes,course,https://www.coursera.org/learn/contenido-matematica-escolar,math-and-logic/math-and-logic
"Greedy Algorithms, Minimum Spanning Trees, and Dynamic Programming",Stanford University,course,https://www.coursera.org/learn/algorithms-greedy,math-and-logic/math-and-logic
Математика для всех,Moscow Institute of Physics and Technology,course,https://www.coursera.org/learn/matematika-dlya-vseh,math-and-logic/math-and-logic
Теория вероятностей для начинающих,Moscow Institute of Physics and Technology,course,https://www.coursera.org/learn/probability-theory-basics,math-and-logic/math-and-logic
Vector Calculus for Engineers,The Hong Kong University of Science and Technology,course,https://www.coursera.org/learn/vector-calculus-engineers,math-and-logic/math-and-logic
Introduction into General Theory of Relativity,National Research University Higher School of Economics,course,https://www.coursera.org/learn/general-relativity,math-and-logic/math-and-logic
Julia Scientific Programming,University of Cape Town,course,https://www.coursera.org/learn/julia-programming,math-and-logic/math-and-logic
Discrete Math and Analyzing Social Graphs,National Research University Higher School of Economics,course,https://www.coursera.org/learn/discrete-math-and-analyzing-social-graphs,math-and-logic/math-and-logic
"Probability Theory, Statistics and Exploratory Data Analysis",National Research University Higher School of Economics,course,https://www.coursera.org/learn/probability-theory-statistics,math-and-logic/math-and-logic
Bayesian Statistics: Techniques and Models,"University of California, Santa Cruz",course,https://www.coursera.org/learn/mcmc-bayesian-statistics,math-and-logic/math-and-logic
First Steps in Linear Algebra for Machine Learning,National Research University Higher School of Economics,course,https://www.coursera.org/learn/first-steps-in-linear-algebra-for-machine-learning,math-and-logic/math-and-logic
Calculus: Single Variable Part 2 - Differentiation,University of Pennsylvania,course,https://www.coursera.org/learn/differentiation-calculus,math-and-logic/math-and-logic
"Everyday Excel, Part 1",University of Colorado Boulder,course,https://www.coursera.org/learn/everyday-excel-part-1,math-and-logic/math-and-logic
Mathematical Biostatistics Boot Camp 1,Johns Hopkins University,course,https://www.coursera.org/learn/biostatistics,math-and-logic/math-and-logic
Bonds & Stocks,University of Michigan,course,https://www.coursera.org/learn/bonds-and-stocks,math-and-logic/math-and-logic
Mathematics for economists,National Research University Higher School of Economics,course,https://www.coursera.org/learn/mathematics-for-economists,math-and-logic/math-and-logic
Introduction to Graph Theory,University of California San Diego,course,https://www.coursera.org/learn/graphs,math-and-logic/math-and-logic
Interest Rate Models,École Polytechnique Fédérale de Lausanne,course,https://www.coursera.org/learn/interest-rate-models,math-and-logic/math-and-logic
Electrodynamics: An Introduction,Korea Advanced Institute of Science and Technology(KAIST),course,https://www.coursera.org/learn/electrodynamics-introduction,math-and-logic/math-and-logic
Statistics with SAS,SAS,course,https://www.coursera.org/learn/sas-statistics,math-and-logic/math-and-logic
Conceptos y Herramientas para la Física Universitaria,Tecnológico de Monterrey,course,https://www.coursera.org/learn/fisica-universitaria,math-and-logic/math-and-logic
Теория графов,Moscow Institute of Physics and Technology,course,https://www.coursera.org/learn/teoriya-grafov,math-and-logic/math-and-logic
Calculus: Single Variable Part 3 - Integration,University of Pennsylvania,course,https://www.coursera.org/learn/integration-calculus,math-and-logic/math-and-logic
Time Value of Money,University of Michigan,course,https://www.coursera.org/learn/time-value-of-money,math-and-logic/math-and-logic
Combinatorics and Probability,University of California San Diego,course,https://www.coursera.org/learn/combinatorics,math-and-logic/math-and-logic
Física: Dimensión y Movimiento,Tecnológico de Monterrey,course,https://www.coursera.org/learn/fisica-dimension-movimiento,math-and-logic/math-and-logic
Fibonacci Numbers and the Golden Ratio,The Hong Kong University of Science and Technology,course,https://www.coursera.org/learn/fibonacci,math-and-logic/math-and-logic
Aprendizaje de las matemáticas de primaria,Universidad de los Andes,course,https://www.coursera.org/learn/aprendizaje-matematicas-primaria,math-and-logic/math-and-logic
Estatística não-paramétrica para a tomada de decisão,Universidade de São Paulo,course,https://www.coursera.org/learn/estatistica-nao-parametrica,math-and-logic/math-and-logic
Robotics: Perception,University of Pennsylvania,course,https://www.coursera.org/learn/robotics-perception,math-and-logic/math-and-logic
Enjoyable Econometrics,Erasmus University Rotterdam,course,https://www.coursera.org/learn/enjoyable-econometrics,math-and-logic/math-and-logic
Mathematics for Computer Science,University of London,course,https://www.coursera.org/learn/mathematics-for-computer-science,math-and-logic/math-and-logic
Single Variable Calculus,University of Pennsylvania,course,https://www.coursera.org/learn/discrete-calculus,math-and-logic/math-and-logic
Information Theory,The Chinese University of Hong Kong,course,https://www.coursera.org/learn/information-theory,math-and-logic/math-and-logic
Discrete Mathematics,Shanghai Jiao Tong University,course,https://www.coursera.org/learn/discrete-mathematics,math-and-logic/math-and-logic
Mechanics of Materials III: Beam Bending,Georgia Institute of Technology,course,https://www.coursera.org/learn/beam-bending,math-and-logic/math-and-logic
Introduction to Applied Cryptography,University of Colorado System,specialization,https://www.coursera.org/specializations/introduction-applied-cryptography,math-and-logic/math-and-logic
Архитектура ЭВМ (Computer Architecture),Saint Petersburg State University,course,https://www.coursera.org/learn/arkhitektura-evm,math-and-logic/math-and-logic
Физика в опытах. Часть 1. Механика,National Research Nuclear University MEPhI,course,https://www.coursera.org/learn/fizika-v-opitah-mehanika,math-and-logic/math-and-logic
Causal Inference,Columbia University,course,https://www.coursera.org/learn/causal-inference,math-and-logic/math-and-logic
Enseñanza de las matemáticas de primaria,Universidad de los Andes,course,https://www.coursera.org/learn/ensenanza-matematicas-primaria,math-and-logic/math-and-logic
Game Theory II: Advanced Applications,Stanford University,course,https://www.coursera.org/learn/game-theory-2,math-and-logic/math-and-logic
Six Sigma Tools for Analyze,University System of Georgia,course,https://www.coursera.org/learn/six-sigma-analyze,math-and-logic/math-and-logic
Number Theory and Cryptography,University of California San Diego,course,https://www.coursera.org/learn/number-theory-cryptography,math-and-logic/math-and-logic
Applied Cryptography,University of Colorado System,specialization,https://www.coursera.org/specializations/applied-crypto,math-and-logic/math-and-logic
Линейная алгебра и аналитическая геометрия,Peter the Great St. Petersburg Polytechnic University,course,https://www.coursera.org/learn/lineynaya-algebra,math-and-logic/math-and-logic
Robotics: Computational Motion Planning,University of Pennsylvania,course,https://www.coursera.org/learn/robotics-motion-planning,math-and-logic/math-and-logic
Éléments de Géomatique,École Polytechnique Fédérale de Lausanne,course,https://www.coursera.org/learn/geomatique,math-and-logic/math-and-logic
Теория игр,Moscow Institute of Physics and Technology,course,https://www.coursera.org/learn/gametheory,math-and-logic/math-and-logic
Introduction to Galois Theory,National Research University Higher School of Economics,course,https://www.coursera.org/learn/galois,math-and-logic/math-and-logic
"Shortest Paths Revisited, NP-Complete Problems and What To Do About Them",Stanford University,course,https://www.coursera.org/learn/algorithms-npcomplete,math-and-logic/math-and-logic
Basic Modeling for Discrete Optimization,The University of Melbourne,course,https://www.coursera.org/learn/basic-modeling,math-and-logic/math-and-logic
Logic for Economists,University of Amsterdam,course,https://www.coursera.org/learn/logic-for-economists,math-and-logic/math-and-logic
离散数学概论 Discrete Mathematics Generality,Peking University,course,https://www.coursera.org/learn/dmathgen,math-and-logic/math-and-logic
Introducción al análisis de Costos para la Dirección de Empresas,Universidad Austral,course,https://www.coursera.org/learn/analisis-costos-direccion-empresas,math-and-logic/math-and-logic
頑想學概率：機率一 (Probability (1)),National Taiwan University,course,https://www.coursera.org/learn/prob1,math-and-logic/math-and-logic
Calculus: Single Variable Part 4 - Applications,University of Pennsylvania,course,https://www.coursera.org/learn/applications-calculus,math-and-logic/math-and-logic
Analytic Combinatorics,Princeton University,course,https://www.coursera.org/learn/analytic-combinatorics,math-and-logic/math-and-logic
Алгоритмизация вычислений (Algorithmic computation),National Research University Higher School of Economics,course,https://www.coursera.org/learn/algoritmizacija-vychislenij,math-and-logic/math-and-logic
Electrodynamics: Electric and Magnetic Fields,Korea Advanced Institute of Science and Technology(KAIST),course,https://www.coursera.org/learn/electrodynamics-electric-magnetic-fields,math-and-logic/math-and-logic
Современная комбинаторика (Modern combinatorics),Moscow Institute of Physics and Technology,course,https://www.coursera.org/learn/modern-combinatorics,math-and-logic/math-and-logic
Introduction to Enumerative Combinatorics,National Research University Higher School of Economics,course,https://www.coursera.org/learn/enumerative-combinatorics,math-and-logic/math-and-logic
Физика в опытах. Часть 2. Электричество и магнетизм,National Research Nuclear University MEPhI,course,https://www.coursera.org/learn/fizika-v-opitah-elektrichestvo-i-magnetizm,math-and-logic/math-and-logic
2.- El Cálculo - Modelo Cuadrático,Tecnológico de Monterrey,course,https://www.coursera.org/learn/calculo-2,math-and-logic/math-and-logic
"Risk, Return & Valuation",University of Michigan,course,https://www.coursera.org/learn/risk-return-and-valuation,math-and-logic/math-and-logic
Aléatoire : une introduction aux probabilités - Partie 1,École Polytechnique,course,https://www.coursera.org/learn/probabilites-1,math-and-logic/math-and-logic
Analyse numérique pour ingénieurs,École Polytechnique Fédérale de Lausanne,course,https://www.coursera.org/learn/analyse-numerique,math-and-logic/math-and-logic
Cryptography and Information Theory,University of Colorado System,course,https://www.coursera.org/learn/crypto-info-theory,math-and-logic/math-and-logic
Robotics: Estimation and Learning,University of Pennsylvania,course,https://www.coursera.org/learn/robotics-learning,math-and-logic/math-and-logic
Введение в математические методы физики,National Research University Higher School of Economics,course,https://www.coursera.org/learn/vvedenie-v-mat-metody,math-and-logic/math-and-logic
Advanced Linear Models for Data Science 1: Least Squares,Johns Hopkins University,course,https://www.coursera.org/learn/linear-models,math-and-logic/math-and-logic
Classical Cryptosystems and Core Concepts,University of Colorado System,course,https://www.coursera.org/learn/classical-cryptosystems,math-and-logic/math-and-logic
Problem Solving Using Computational Thinking,University of Michigan,course,https://www.coursera.org/learn/compthinking,math-and-logic/math-and-logic
Decision Criteria & Applications,University of Michigan,course,https://www.coursera.org/learn/decision-criteria-and-applications,math-and-logic/math-and-logic
Electrodynamics: In-depth Solutions for Maxwell’s Equations,Korea Advanced Institute of Science and Technology(KAIST),course,https://www.coursera.org/learn/electrodynamics-solutions-maxwells-equations,math-and-logic/math-and-logic
Mind and Machine,University of Colorado Boulder,specialization,https://www.coursera.org/specializations/mind-machine,math-and-logic/math-and-logic
Matrix Methods,University of Minnesota,course,https://www.coursera.org/learn/matrix-methods,math-and-logic/math-and-logic
Robotics: Mobility,University of Pennsylvania,course,https://www.coursera.org/learn/robotics-mobility,math-and-logic/math-and-logic
Electrodynamics: Analysis of Electric Fields,Korea Advanced Institute of Science and Technology(KAIST),course,https://www.coursera.org/learn/electrodynamics-analysis-of-electric-fields,math-and-logic/math-and-logic
Dynamical Modeling Methods for Systems Biology,Icahn School of Medicine at Mount Sinai,course,https://www.coursera.org/learn/dynamical-modeling,math-and-logic/math-and-logic
Математическая теория игр,Saint Petersburg State University,course,https://www.coursera.org/learn/matematicheskaya-teoria-igr,math-and-logic/math-and-logic
Mathematical Game Theory,Saint Petersburg State University,course,https://www.coursera.org/learn/mathematical-game-theory,math-and-logic/math-and-logic
Геометрия и группы,Moscow Institute of Physics and Technology,course,https://www.coursera.org/learn/geometriya-i-gruppy,math-and-logic/math-and-logic
Methods of Surface Analysis,National Research Nuclear University MEPhI,course,https://www.coursera.org/learn/methods-surface-analysis,math-and-logic/math-and-logic
Introduction à la théorie de Galois,École normale supérieure,course,https://www.coursera.org/learn/theorie-de-galois,math-and-logic/math-and-logic
Применение производной и интеграла в курсе общей физики,National Research Nuclear University MEPhI,course,https://www.coursera.org/learn/proizvodnaya-i-integral-v-fizike,math-and-logic/math-and-logic
Квантовые вычисления (Quantum computing),Saint Petersburg State University,course,https://www.coursera.org/learn/kvantovyye-vychisleniya,math-and-logic/math-and-logic
Advanced Modeling for Discrete Optimization,The University of Melbourne,course,https://www.coursera.org/learn/advanced-modeling,math-and-logic/math-and-logic
3.- El Cálculo - Modelo Cúbico,Tecnológico de Monterrey,course,https://www.coursera.org/learn/calculo-3,math-and-logic/math-and-logic
竞争策略（中文版）,Ludwig-Maximilians-Universität München (LMU),course,https://www.coursera.org/learn/competitivestrategyzh,math-and-logic/math-and-logic
What is “the mind” and what is artificial intelligence?,University of Colorado Boulder,course,https://www.coursera.org/learn/mind-machine-artificial-intelligence,math-and-logic/math-and-logic
Symmetric Cryptography,University of Colorado System,course,https://www.coursera.org/learn/symmetric-crypto,math-and-logic/math-and-logic
Initiation à la théorie des distributions,École Polytechnique,course,https://www.coursera.org/learn/theorie-des-distributions,math-and-logic/math-and-logic
Solving Algorithms for Discrete Optimization,The University of Melbourne,course,https://www.coursera.org/learn/solving-algorithms-discrete-optimization,math-and-logic/math-and-logic
Введение в механику деформируемого твёрдого тела (Introduction to the mechanics of deformable solids),Saint Petersburg State University,course,https://www.coursera.org/learn/mekhanika-tvordogo-tela,math-and-logic/math-and-logic
Introduction to Formal Concept Analysis,National Research University Higher School of Economics,course,https://www.coursera.org/learn/formal-concept-analysis,math-and-logic/math-and-logic
Delivery Problem,University of California San Diego,course,https://www.coursera.org/learn/delivery-problem,math-and-logic/math-and-logic
Games without Chance: Combinatorial Game Theory,Georgia Institute of Technology,course,https://www.coursera.org/learn/combinatorial-game-theory,math-and-logic/math-and-logic
Invitation to Mathematics הזמנה למתמטיקה,Hebrew University of Jerusalem,course,https://www.coursera.org/learn/introduction-to-math,math-and-logic/math-and-logic
Asymmetric Cryptography and Key Management,University of Colorado System,course,https://www.coursera.org/learn/asymmetric-crypto,math-and-logic/math-and-logic
Mathematical Biostatistics Boot Camp 2,Johns Hopkins University,course,https://www.coursera.org/learn/biostatistics-2,math-and-logic/math-and-logic
Quantitative Foundations for International Business,University of London,course,https://www.coursera.org/learn/quantitative-foundations-international-business,math-and-logic/math-and-logic
Advanced Linear Models for Data Science 2: Statistical Linear Models,Johns Hopkins University,course,https://www.coursera.org/learn/linear-models-2,math-and-logic/math-and-logic
Çok değişkenli Fonksiyon I: Kavramlar / Multivariable Calculus I: Concepts,Koç University,course,https://www.coursera.org/learn/hesap-calculus-dersi,math-and-logic/math-and-logic
Введение в теорию кибернетических систем,Saint Petersburg State University,course,https://www.coursera.org/learn/kiberneticheskie-sistemy,math-and-logic/math-and-logic
頑想學概率：機率二 (Probability (2)),National Taiwan University,course,https://www.coursera.org/learn/prob2,math-and-logic/math-and-logic
离散数学,Shanghai Jiao Tong University,course,https://www.coursera.org/learn/discrete-mathematics-ch,math-and-logic/math-and-logic
"Introduzione alla fisica sperimentale: meccanica, termodinamica",Politecnico di Milano,course,https://www.coursera.org/learn/fisica-sperimentale-meccanica-termodinamica,math-and-logic/math-and-logic
مجموعة أدوات عالم البيانات,Johns Hopkins University,course,https://www.coursera.org/learn/data-scientists-tools-ar,math-and-logic/math-and-logic
Causal Inference 2,Columbia University,course,https://www.coursera.org/learn/causal-inference-2,math-and-logic/math-and-logic
