title,university,form,link,category
4.- El Cálculo - Otros Modelos,Tecnológico de Monterrey,course,https://www.coursera.org/learn/calculo-4,math-and-logic/math-and-logic
Cryptographic Hash and Integrity Protection,University of Colorado System,course,https://www.coursera.org/learn/cryptographic-hash-integrity-protection,math-and-logic/math-and-logic
悖论：思维的魔方,Peking University,course,https://www.coursera.org/learn/bei-lun,math-and-logic/math-and-logic
Случайные графы,Moscow Institute of Physics and Technology,course,https://www.coursera.org/learn/sluchajnye-graphy,math-and-logic/math-and-logic
Doğrusal Cebir I: Uzaylar ve İşlemciler / Linear Algebra I: Spaces and Operators,Koç University,course,https://www.coursera.org/learn/linearalgebra1,math-and-logic/math-and-logic
离散优化建模基础篇 Basic Modeling for Discrete Optimization,The Chinese University of Hong Kong,course,https://www.coursera.org/learn/lisan-youhua-jianmo-jichupian,math-and-logic/math-and-logic
Jacobi modular forms: 30 ans après,National Research University Higher School of Economics,course,https://www.coursera.org/learn/modular-forms-jacobi,math-and-logic/math-and-logic
Computational Vision,University of Colorado Boulder,course,https://www.coursera.org/learn/mind-machine-computational-vision,math-and-logic/math-and-logic
Mécanique Lagrangienne,École Polytechnique Fédérale de Lausanne,course,https://www.coursera.org/learn/mecanique-lagrangienne,math-and-logic/math-and-logic
Aléatoire : une introduction aux probabilités - Partie 2,École Polytechnique,course,https://www.coursera.org/learn/probabilites-2,math-and-logic/math-and-logic
Methods for Solving Problems,University of Colorado Boulder,course,https://www.coursera.org/learn/mind-machine-problem-solving-methods,math-and-logic/math-and-logic
Explorando os recursos educacionais da Khan Academy,Fundação Lemann,course,https://www.coursera.org/learn/khanacademy,math-and-logic/math-and-logic
Automated Reasoning: Symbolic Model Checking,EIT Digital,course,https://www.coursera.org/learn/automated-reasoning-symbolic-model-checking,math-and-logic/math-and-logic
Robotics: Capstone,University of Pennsylvania,course,https://www.coursera.org/learn/robotics-capstone,math-and-logic/math-and-logic
"Interpersonal, Developmental, and Evolutionary Perspectives of the Mind",University of Colorado Boulder,course,https://www.coursera.org/learn/mind-machine-perspectives,math-and-logic/math-and-logic
